main-forum	deft-forum	2014	0401	1.6	When Christians are extreme its just simply religion.	When Muslims are extreme it's terrorism.
main-forum	deft-forum	2014	0402	1.2	Some believe the 'right' is most important.	Some believe not slaughtering the unborn is most important.
main-forum	deft-forum	2014	0403	1.6	Evolution is not an opinion, not a belief.	Atomic theory is not an opinion, not a belief.
main-forum	deft-forum	2014	0404	2.8	I am not the one claiming the right to decide over another woman's body.	You want others to decide over a woman body.
main-forum	deft-forum	2014	0405	0.8	Where in the world is Ron Paul?	Where in the world is the MEDIA??
main-forum	deft-forum	2014	0406	2.4	you have no remains of a missile at the pentagon.	you have no remains of an A- at the pentagon.
main-forum	deft-forum	2014	0407	3.4	The point you quote should say "I never said rehabilitation could never work."	For the trillionth time, I've never said rehabilitation doesn't work.
main-forum	deft-forum	2014	0408	1.53333333333333	 billion . Everyone in the world at Mexico's current prosperity level.	Everyone in the world at the current "prosperity" level of Northwest Africa.
main-forum	deft-forum	2014	0409	3.8	my hair is pretty thing tho :/ Quote: Ditto.	my hair is pretty thing tho :/ woops!
main-forum	deft-forum	2014	0410	1.2	It wouldn't stop joke marriages.	And I don't fight for marriage.
main-forum	deft-forum	2014	0411	1.6	You seem to think that poor people are not responsible for their actions.	People are responsible for their actions.
main-forum	deft-forum	2014	0412	2.4	Why did that transaction take place.	Did the transaction take place?
main-forum	deft-forum	2014	0413	0	It's about the baggage attached.	It's not the same thing.
main-forum	deft-forum	2014	0414	3.6	We are all vessels filled with many wonders.	Put a Little Love in your Heart We are all vessels filled with many wonders.
main-forum	deft-forum	2014	0415	2.46666666666667	the problem isn't who has money.	the problem is who doesn't have money.
main-forum	deft-forum	2014	0416	1.6	What makes you think the owl didn't participate?	It doesn't say that it didn't participate.
main-forum	deft-forum	2014	0417	1.8	lol Looking forward to seeing your built-in's!	Look forward to seeing it!
main-forum	deft-forum	2014	0418	1.2	Originally Posted by jacko!	Originally Posted by IZZY!
main-forum	deft-forum	2014	0419	4.8	Thanks Candy for starting the thread.	Candy - Thanks for starting us off today.
main-forum	deft-forum	2014	0420	1	Except that it wasn't.	Except that they couldn't.
main-forum	deft-forum	2014	0421	2.2	If I owe you , dollars, I have a problem.	If I owe you a trillion dollars, you have a problem.
main-forum	deft-forum	2014	0422	4.8	If evidence is not provided to support a position; then it should be rejected.	If a position is unverifiable; then it should be rejected.
main-forum	deft-forum	2014	0423	1.4	Everyone else at the current prosperity level of Mexico.	Everyone in the world at the current "prosperity" level of Northwest Africa.
main-forum	deft-forum	2014	0424	1.8	Bush gets zero credit for the budget under him.	And, Obama gets zero credit for the budget under him.
main-forum	deft-forum	2014	0425	0.8	LOL Don't you have to take a test to drive a vehicle in the US?	Is there a test to own a firearm in the US?
main-forum	deft-forum	2014	0426	3.2	We both thought the movie was good and we didn't find it confusing in any way.	I thought it was good, and I didn't find it confusing.
main-forum	deft-forum	2014	0427	5	If God does not exist can anything be morally wrong?	I ask again if God does not exist can anything be morally wrong?
main-forum	deft-forum	2014	0428	3.6	A law is constitutional if it does not conflict with the Constitution.	To be unconsititutional means to violate the constitution.
main-forum	deft-forum	2014	0429	1.2	Originally Posted by muslim girl ooops sorry!	Originally Posted by muslim girl its not a complete impossibility.
main-forum	deft-forum	2014	0430	1.4	This is not your country.	This is our country.
main-forum	deft-forum	2014	0431	1	Originally Posted by zaf I suppose the water in the middle makes a difference.	Originally Posted by zaf in the long term, yes.
main-forum	deft-forum	2014	0432	4.2	Cone threw an  game.	Addie Joss Cone threw an  game.
main-forum	deft-forum	2014	0433	4.8	Edited by LashL: Edited to properly mask profanity.	Edited by LashL: Edited to properly mask profanity in quoted post.
main-forum	deft-forum	2014	0434	1.6	The jury is not told about juror nullification.	The quote you provide has nothing to do with jury nullification.
main-forum	deft-forum	2014	0435	1	runs victim down Got any proof?	paranoid Got any proof?
main-forum	deft-forum	2014	0436	4.2	you don't use the search button much, do you?	you don't use the search button AT ALL, do you?
main-forum	deft-forum	2014	0437	3.6	I don't think Paul has a shot.	Paul doesn't have a shot.
main-forum	deft-forum	2014	0438	3.2	Time of the Season by the Zombies We are all vessels filled with many wonders.	Joy to the World We are all vessels filled with many wonders.
main-forum	deft-forum	2014	0439	4.57142857142857	Do you notice the nonsensical things you are saying?	And to be fair, do you notice the nonsensical things you are saying?
main-forum	deft-forum	2014	0440	1	What if they messed up a study?	What if they had a personal bias?
main-forum	deft-forum	2014	0441	1.2	Specifically a Baptist.	Specifically Gnostic.
main-forum	deft-forum	2014	0442	0.8	And a large part of the east coast.	And parts of the west coast.
main-forum	deft-forum	2014	0443	1.4	Why are you talking about women within the Hebrew tribes?	We were talking about women as war bounty were we not?
main-forum	deft-forum	2014	0444	2.6	Last night Japanese forces attacked Hong Kong.	Last night Japanese forces attacked the Philippine Islands.
main-forum	deft-forum	2014	0445	3.6	. What is your definition of "life force"?	What is your definition of "soul"?
main-forum	deft-forum	2014	0446	2.6	That is not direct responsibilty to the constituents.	Aye but they ARE responsible to their constituents.
main-forum	deft-forum	2014	0447	4	The ideology was built around violent expansion, so yes - VIOLENT expansion.	The ideology was built around violent expansion and race superiority.
main-forum	deft-forum	2014	0448	4.6	Could this have been an enema?	@ossobuco, Could this have been an enema?
main-forum	deft-forum	2014	0449	0.4	my final word: ignoring has the effect of normalizing.	taking advantage has the effect of reinforcing.
