OnWN	2014	0709	4	Sell something to or obtain something from by underhanded activity.	sell something to or obtain something from by energetic and especially underhanded activity.
OnWN	2014	0710	0	state of being unclothed, naked	the act of climbing something.
OnWN	2014	0711	0	the noise of something rapping against a surface	the event of something burning (often destructive).
OnWN	2014	0712	0.2	the act of forecasting or predicting something	the act of retaining something.
OnWN	2014	0713	4.4	Supply with water for crops, as with channels, ditches, or streams.	supply with water, as with channels or ditches or streams.
OnWN	2014	0714	0.8	snatching or capturing a freely moving object	searching for or buying goods or services.
OnWN	2014	0715	0	(Cause to) become widely distributed.	become or cause to become obstructed.
OnWN	2014	0716	1.26666666666667	The human act of making something new.	the speech act of making something evident.
OnWN	2014	0717	4	trace the form or outline of	show the form or outline of.
OnWN	2014	0718	0	Hollow out in the form of a furrow or groove.	move through with or as if with a rake.
OnWN	2014	0719	0	The act of purchasing back something previously sold.	the act of explaining; making something plain or intelligible.
OnWN	2014	0720	1.2	the activity of examining or assessing something	the act of forming or establishing something.
OnWN	2014	0721	4.4	Complain; talk in a tearful manner.	talk in a tearful manner.
OnWN	2014	0722	0	exist in a certain manner, mode, or style	the last or lowest in an ordering or series.
OnWN	2014	0723	0.4	the act of harming or hurting someone	the act of choosing or selecting.
OnWN	2014	0724	4.6	glean or gather natural products	gather, as of natural products.
OnWN	2014	0725	4.26666666666667	put up with something unpleasant	put up with something or somebody unpleasant.
OnWN	2014	0726	0.2	Saturate or inocculate with a substance.	make a mark or lines on a surface.
OnWN	2014	0727	0	the act of turning, rotating an object	the act of adding one thing to another.
OnWN	2014	0728	4.4	make tracks on a surface	make a mark or lines on a surface.
OnWN	2014	0729	0.8	the act of putting something to use.	the act of hiring something or someone.
OnWN	2014	0730	0	the identification or the realization of something	the time period that is considered best for starting or finishing something.
OnWN	2014	0731	4	to make ready, fit out	make ready for action or use.
OnWN	2014	0732	0.8	the act of intentionally omitting something	the act of rending or ripping or splitting something.
OnWN	2014	0733	1.4	the act of substituting one thing for another	the act of adding one thing to another.
OnWN	2014	0734	3.8	Cause to move forward with force.	vary or move from a fixed point or course.
OnWN	2014	0735	0	the manner in which something or someon functions or operates	the amount by which something decreases.
OnWN	2014	0736	1.8	injure by turning or rotating	move by turning over or rotating.
OnWN	2014	0737	0.6	the act of forecasting or predicting something	the act of decreasing or reducing something.
OnWN	2014	0738	2.2	cause to be in a state or location	put into a certain place or abstract location.
OnWN	2014	0739	0.4	protect with or as if with a shield	maintain with or as if with a bet.
OnWN	2014	0740	0.6	The human act of making something new.	the act of raising something.
OnWN	2014	0741	5	the concluding section of a communication	the last section of a communication.
OnWN	2014	0742	0	the crown of a flowering plant	the reduction of something's value or worth.
OnWN	2014	0743	4.6	want, desire or perfer to do something	prefer or wish to do something.
OnWN	2014	0744	0.6	the activity of pretending to be someone or something else	the act of liberating someone or something.
OnWN	2014	0745	4.4	Supply with water for crops, as with channels, ditches, or streams.	supply with water, as with channels or ditches or streams.
OnWN	2014	0746	0.2	the act of combining, blending, integrating	(theology) God's act of bringing the universe into existence.
OnWN	2014	0747	1	the activity of pretending to be someone or something else	the act of damaging something or someone.
OnWN	2014	0748	3.7	the act of harming or hurting someone	the act of damaging something or someone.
OnWN	2014	0749	4.26666666666667	put up with something unpleasant	put up with something or somebody unpleasant.
