OnWN	2014	0000	4	the activity of learning or being trained	the gradual process of acquiring knowledge.
OnWN	2014	0001	3.8	thin metal strips used in typesetting	thin strip of metal used to separate lines of type in printing.
OnWN	2014	0002	4.2	falcon: abandon intended game and pursue lesser prey	abandon the intended prey, turn, and pursue an inferior prey.
OnWN	2014	0003	1.8	the act of designating a role to someone	the act of designating or identifying something.
OnWN	2014	0004	4	make pure or free from sin	make pure or free from sin or guilt.
OnWN	2014	0005	4	leave undone or leave out	fail to do something; leave something undone.
OnWN	2014	0006	3.6	a social set or clique of friends	an unofficial association of people or groups.
OnWN	2014	0007	4.4	The upper part of a column.	the upper part of a column that supports the entablature.
OnWN	2014	0008	3	sink to a lower level; descend	sink to a lower level or form a depression.
OnWN	2014	0009	4.6	create code or computer programs	create code, write a computer program.
OnWN	2014	0010	3.2	release from confinement, obligation, or a burden	grant relief or an exemption from a rule or requirement to.
OnWN	2014	0011	4.4	(Cause to) sully the good name and reputation of.	charge falsely or with malicious intent; attack the good name and reputation of someone.
OnWN	2014	0012	3.4	a company that provides public service commodities	a company that performs a public service; subject to government regulation.
OnWN	2014	0013	4.4	Physically extend or spread outward from a center or focus or inward towards a center; physically spread from a start point.	extend or spread outward from a center or focus or inward towards a center.
OnWN	2014	0014	5	Distribute systematically or strategically; initiate.	to distribute systematically or strategically.
OnWN	2014	0015	3.6	create something in the mind	form a mental image of something that is not present or that is not the case.
OnWN	2014	0016	4.8	(cause to) become less clear or indistinct	to make less distinct or clear.
OnWN	2014	0017	3.8	exempt or free from a burden, duty, or requirement	free from a burden, evil, or distress.
OnWN	2014	0018	4.2	a straight length of road or racetrack	a straightaway section of a racetrack.
OnWN	2014	0019	4.2	(cause to) emit a brief burst of light	emit a brief burst of light.
OnWN	2014	0020	3.2	stretch to the utmost, causing stress or injury	alter the shape of (something) by stress.
OnWN	2014	0021	4.4	move in a group or flock	move as a crowd or in a group.
OnWN	2014	0022	4.8	a temporary debarment, revoking of a privilege	a temporary debarment (from a privilege or position etc).
OnWN	2014	0023	4.8	An imperfection; the quality of being inadequate or falling short.	the quality of being inadequate or falling short of perfection.
OnWN	2014	0024	4.6	clear mucus from one's throat	clear mucus or food from one's throat.
OnWN	2014	0025	3.6	preserve, keep in safety, use frugally	keep in safety and protect from harm, decay, loss, or destruction.
OnWN	2014	0026	4.6	an address used for postal communication	the address where a person or organization can be communicated with.
OnWN	2014	0027	4	An organization that sponsors a large public event	any organization that provides resources and facilities for a function or event.
OnWN	2014	0028	4.2	legally approve or ratify a person for a position	support a person for a position.
OnWN	2014	0029	5	Try to cure by special care or treatment, of an illness or injury; treat carefully.	try to cure by special care of treatment, of an illness or injury.
OnWN	2014	0030	1.4	anything with the form of a thin strip	a long thin implement resembling a length of wood.
OnWN	2014	0031	4	the controlling component of a grammatical constituent	(grammar) the word in a grammatical constituent that plays the same grammatical role as the whole constituent.
OnWN	2014	0032	3.6	reach a destination or goal	reach a destination; arrive by movement or progress.
OnWN	2014	0033	4.5	Shrivel, wither, or mature imperfectly, as of a flower.	shrivel or wither or mature imperfectly.
OnWN	2014	0034	4.8	Part, cease, or break association with (something).	part; cease or break association with.
OnWN	2014	0035	3.6	a cue given to someone for assistance	a cue given to a performer (usually the beginning of the next line to be spoken).
OnWN	2014	0036	1.6	make more common, uniform or general	draw from specific cases for more general cases.
OnWN	2014	0037	4.8	(cause to) burst or open, usually with a sharp sound	burst open with a sharp, explosive sound.
OnWN	2014	0038	3.4	Make (undue) claims of owning.	make undue claims to having.
OnWN	2014	0039	4.8	the political head of city government	the head of a city government.
OnWN	2014	0040	4.2	to cause to become quiet	become quiet or still; fall silent.
OnWN	2014	0041	4	More forward in a leaping or skipping manner.	move forward by leaps and bounds.
OnWN	2014	0042	4.4	give up right or possession to another	give up or agree to forgo to the power or possession of another.
OnWN	2014	0043	4.6	come as a logical consequence, be inferred	come as a logical consequence; follow logically.
OnWN	2014	0044	5	the event of gradually vanishing from view	the event of fading and gradually vanishing from sight.
OnWN	2014	0045	4	feel anxious, concerned, uneasy, or apprehensive about	be afraid or feel anxious or apprehensive about a possible or probable situation or event.
OnWN	2014	0046	3.8	travel in or be shaped like a zigzag	travel along a zigzag path.
OnWN	2014	0047	5	create a mess or disorder	make a mess of or create disorder in.
OnWN	2014	0048	5	the state of being employed	the state of being employed or having a job.
OnWN	2014	0049	4.8	a sculpture of a human or animal	a sculpture representing a human or animal.
OnWN	2014	0050	1.75	(abstract) characterize, commemorate, make special (or respectful)	be a distinctive feature, attribute, or trait; sometimes in a very positive sense.
OnWN	2014	0051	4	operating or traveling via a vehicle	travel or be transported in a vehicle.
OnWN	2014	0052	4.2	(cause to) fall or subside to a lower place, level, or value	fall or descend to a lower place or level.
OnWN	2014	0053	4	the ability to recall things	the ability to recall past occurrences.
OnWN	2014	0054	3.4	An animate agent utters with a spitting sound, as if in a rage.	utter with a spitting sound, as if in a rage.
OnWN	2014	0055	3.2	the noise of something rapping against a surface	the sound of knocking (as on a door or in an engine or bearing).
OnWN	2014	0056	2.6	Ask for and get something for free.	ask for and get free; be a parasite.
OnWN	2014	0057	1.6	a general condition of soundness of a system or machine	the general condition of body and mind.
OnWN	2014	0058	4.4	an area enclosed by walls or buildings	an area wholly or partly surrounded by walls or buildings.
OnWN	2014	0059	4.4	raising the stakes or bet of a game by a factor of 2	raising the stakes in a card game by a factor of 2.
OnWN	2014	0060	3	the act of surrendering an asset	the act of losing or surrendering something as a penalty for a mistake or fault or failure to perform etc..
OnWN	2014	0061	2.8	protect or speak up against criticism or opposition	protect or fight for as a champion.
OnWN	2014	0062	4	A relation of affinity or harmony between people.	a relation of affinity or harmony between people; whatever affects one correspondingly affects the other.
OnWN	2014	0063	4	save from an experience, action or harm	save or relieve from an experience or action.
OnWN	2014	0064	4.8	go around the rim of	run around the rim of.
OnWN	2014	0065	0.8	take in (mentally or physically)	take (gas, light or heat) into a solution.
OnWN	2014	0066	4.2	separate (as if) by passing through a sieve	separate by passing through a sieve or other straining device to separate out coarser elements.
OnWN	2014	0067	5	a cultivated plant that is now growing wild	a plant originally cultivated but now growing wild.
OnWN	2014	0068	5	speed up the process of	speed up the progress of; facilitate.
OnWN	2014	0069	4.8	Provide evidence for; show by one's behavior, attitude, or external attributes; embody.	provide evidence for; stand as proof of; show by one's behavior, attitude, or external attributes.
OnWN	2014	0070	4.2	a computer program that performs system support	(computer science) a program designed for general support of the processes of a computer.
OnWN	2014	0071	4.4	the length of time of a temporary cessation	a time interval during which there is a temporary cessation of something.
OnWN	2014	0072	3.4	rhythmical thrusting of the legs in a swim stroke	a rhythmic thrusting movement of the legs as in swimming or calisthenics.
OnWN	2014	0073	3.8	Make more temperate, acceptable, or suitable.	make more temperate, acceptable, or suitable by adding something else; moderate.
OnWN	2014	0074	4.6	confine in or as if in a prison	confine as if in a prison.
OnWN	2014	0075	4.2	make amorous or sexual advances toward	approach with an offer of sexual favors.
OnWN	2014	0076	3.75	Put down by force, intimidation, or authority, as of a person; correct by punishment or discipline.	correct by punishment or discipline.
OnWN	2014	0077	2.8	break up a solid, usually into a solution	cause to go into a solution.
OnWN	2014	0078	4.6	A movement (physical or abstract) back from an impact.	a movement back from an impact.
OnWN	2014	0079	4.6	the act of putting something to use.	the action of putting something into operation.
OnWN	2014	0080	0.4	(cause to) relax, be at ease, assume a friendly manner	disentangle and raise the fibers of.
OnWN	2014	0081	3.2	a physical framework of crossing strips, often wooden	framework consisting of an ornamental design made of strips of wood or metal.
OnWN	2014	0082	3.6	an itemized statement of money owed	an itemized statement of money owed for goods shipped or services rendered.
OnWN	2014	0083	4.6	positively-charged center part of an atom	the positively charged dense center of an atom.
OnWN	2014	0084	3.8	An event that causes someone or something to die.	an event that causes someone to die.
OnWN	2014	0085	0.8	indicate a decision or prediction	declare in the capacity of an umpire or referee.
OnWN	2014	0086	4.6	state of being active, bustling about	the trait of being active; moving or acting rapidly and energetically.
OnWN	2014	0087	4	cause to become awake or alert	cause to be alert and energetic.
OnWN	2014	0088	4.6	Look through a book or some other written material (for information).	look through a book or other written material.
OnWN	2014	0089	5	the conclusion of a communication	the last section of a communication.
OnWN	2014	0090	4	meet or encounter on social or professional capacity	go to see for professional or business reasons.
OnWN	2014	0091	4.4	assembled group of spectators at a performance	a gathering of spectators or listeners at a (usually public) performance.
OnWN	2014	0092	3.6	give interlinear explanations or citations for text	provide an interlinear translation of a word or phrase.
OnWN	2014	0093	3.6	Leave to someone after one's death.	leave or give by will after one's death.
OnWN	2014	0094	3	cause to vibrate in a different pattern	cause to vibrate in a definite pattern.
OnWN	2014	0095	3.8	compel, enforce, or insist on something	compel to behave in a certain way.
OnWN	2014	0096	0.4	draw a cross in the air over something	travel across or pass over.
OnWN	2014	0097	4.2	give away something that is not needed	give up what is not strictly needed.
OnWN	2014	0098	4.6	(Cause to) become less interesting, attractive or vigorous.	become less interesting or attractive.
OnWN	2014	0099	4.4	have a disagreement or quarrel over something	have a disagreement over something.
OnWN	2014	0100	1.4	endure or experience a painful event	undergo (as of injuries and illnesses).
OnWN	2014	0101	4	the manner in which something or someon functions or operates	process or manner of functioning or operating.
OnWN	2014	0102	4	the event of coming to a stop, ending something	the event of something ending.
OnWN	2014	0103	4.4	return to a prior state	return to an original state.
OnWN	2014	0104	4.6	the United States, especially the North during the Civil War	the United States (especially the northern states during the American Civil War).
OnWN	2014	0105	4	(cause to) become overloaded or overcharged	place too much a load on.
OnWN	2014	0106	3.4	the act of substituting one thing for another	the act of furnishing an equivalent person or thing in the place of another.
OnWN	2014	0107	3.4	imagine; form a mental picture of something	form a mental picture of something that is invisible or abstract.
OnWN	2014	0108	3.4	indicate a decision or prediction	indicate a decision in regard to.
OnWN	2014	0109	5	carry a burden, real or metaphorical	carry a burden, either real or metaphoric.
OnWN	2014	0110	2.8	An official task or undertaking, usually funded	any piece of work that is undertaken or attempted.
OnWN	2014	0111	3.2	the complete haploid sequence of DNA of an organism	the ordering of genes in a haploid set of chromosomes of a particular organism; the full DNA sequence of an organism.
OnWN	2014	0112	4.6	stamp or emboss with a block	stamp or emboss a title or design on a book with a block.
OnWN	2014	0113	3.8	(medicine) the capacity of an organism to defend against disease.	(medicine) the condition in which an organism can resist disease.
OnWN	2014	0114	5	a flock of sheep or goats	a group of sheep or goats.
OnWN	2014	0115	3.8	a unit of atmospheric pressure	(meteorology) a unit of pressure equal to a million dynes per square centimeter.
OnWN	2014	0116	3	a winning shot in tennis against opponent's serve	(tennis) a score consisting of winning a game when your opponent was serving.
OnWN	2014	0117	4.4	a messenger deployed on a mission on behalf of someone else	someone sent on a mission to represent the interests of someone else.
OnWN	2014	0118	4.6	the act of taking an offer	the act of taking something that is offered.
OnWN	2014	0119	4.8	hit or return before it touches the ground	hit before it touches the ground.
OnWN	2014	0120	3.4	a thrusting weapon, as a sword	a cutting or thrusting weapon that has a long metal blade and a hilt with a hand guard.
OnWN	2014	0121	3.8	mix or breed things of different varieties or qualities	breed animals or plants using parents of different races and varieties.
OnWN	2014	0122	3.8	Walk heavily and firmly (like a cat) as when weary or over soft terrain.	walk heavily and firmly, as when weary, or through mud.
OnWN	2014	0123	3.4	pay unsolicited sexual attention to	pay unsolicited and usually unwanted sexual attention to.
OnWN	2014	0124	4.4	Release (gas or energy) as a result of a chemical reaction or physical decomposition (perhaps in a metaphorical sense)	release (gas or energy) as a result of a chemical reaction or physical decomposition.
OnWN	2014	0125	4.8	reshow a play or broadcast	rerun a performance of a play, for example.
OnWN	2014	0126	1.4	a figurative position in relation to other positions, as in arguments	a position given by its location to the side of an object.
OnWN	2014	0127	3	state of being under control	the state of being controlled or governed.
OnWN	2014	0128	4.8	a vehicle race on public roads	an automobile race run over public roads.
OnWN	2014	0129	5	Amount that can be contained	the amount that can be contained.
OnWN	2014	0130	4.2	take legal action to seek compensation for a wrong	institute legal proceedings against; file a suit against.
OnWN	2014	0131	3	move into and stay in a particular position	put into a certain place or abstract location.
OnWN	2014	0132	4.4	opening shot in billiards or pool	the opening shot that scatters the balls in billiards or pool.
OnWN	2014	0133	3.8	an instrument of torture applied to foot and leg	an instrument of torture that is used to heat or crush the foot and leg.
OnWN	2014	0134	4.91666666666667	(cause to) separate or move in different directions	to cause to separate and go in different directions.
OnWN	2014	0135	3	An established or recognized right, formal or informal.	an informal right to something.
OnWN	2014	0136	2.8	fetching something from a source	act of getting or draining something such as electricity or a liquid from a source.
OnWN	2014	0137	4.6	communicate or make known by gestures, action, or signs	communicate silently and non-verbally by signals or signs.
OnWN	2014	0138	4.8	strike the upper part of a ball giving it forward spin	strike (the top part of a ball in golf, baseball, or pool) giving it a forward spin.
OnWN	2014	0139	5	the act of spending, disbursing funds	the act of spending or disbursing money.
OnWN	2014	0140	0	recording tracks of music made on some medium	a trench resembling a furrow that was made by erosion or excavation.
OnWN	2014	0141	3.6	an inherent aptitude or talent	an aptitude that may be developed.
OnWN	2014	0142	4.6	Make liberal or more liberal, become more liberal, usually in terms of laws or rules.	make liberal or more liberal, of laws and rules.
OnWN	2014	0143	3.6	free from obligations, service or confinement	free from obligations or duties.
OnWN	2014	0144	4.6	twist a body part suddenly so as to sprain	twist suddenly so as to sprain.
OnWN	2014	0145	3.2	a cause or source of duress, worry	difficulty that causes worry or emotional tension.
OnWN	2014	0146	3.6	a state of an authority managing or dominating a circumstance	the activity of managing or exerting control over something.
OnWN	2014	0147	0.6	move (as if) by lowering	come as if by falling.
OnWN	2014	0148	4.2	Process, or refine in a reverberating furnace	treat, process, heat, melt, or refine in a reverberatory furnace.
OnWN	2014	0149	4.8	economic term: raise economic demand, expand the money supply, or raise prices to experience reflation	economics: raise demand, expand the money supply, or raise prices, after a period of deflation.
OnWN	2014	0150	3	clean, cleanse, or able to be cleaned	cleanse with a cleaning agent, such as soap, and water.
OnWN	2014	0151	2.4	Summon into action or bring into existence, often as if by magic; ask for the aid or protection of.	request earnestly (something from somebody); ask for aid or protection.
OnWN	2014	0152	3.6	the act of throwing a baseball	(baseball) the act of throwing a baseball by a pitcher to a batter.
OnWN	2014	0153	4.6	Break the skin (of a body part) by scraping; impact something else.	break the skin (of a body part) by scraping.
OnWN	2014	0154	4.8	Allocate or dedicate; set aside or apart for a specific purpose or use.	set aside or apart for a specific purpose or use.
OnWN	2014	0155	2.8	(attempt to) convince to enroll, join or participate	register formally as a participant or member.
OnWN	2014	0156	3.4	give a specific interpretation to	twist and turn so as to give an intended interpretation.
OnWN	2014	0157	4.4	Organize anew, as after a setback; collect or compose oneself.	organize anew, as after a setback.
OnWN	2014	0158	4.6	to catch in or as if in a trap; immobilize	catch in or as if in a trap.
OnWN	2014	0159	4.8	an exclusive, privileged group of people	an exclusive group of people.
OnWN	2014	0160	4.4	come into conflict, meet in opposition	be incompatible; be or come into conflict.
OnWN	2014	0161	4.6	react, or respond to a call, command, or stimulus	react to a stimulus or command.
OnWN	2014	0162	3.4	provide with a soundtrack or voiceover	provide (movies) with a soundtrack of a foreign language.
OnWN	2014	0163	4.4	a lever that activates a firing mechanism, especially with a firearm	lever that activates the firing mechanism of a gun.
OnWN	2014	0164	4.85	Advance; contribute to the progress or growth of.	contribute to the progress or growth of.
OnWN	2014	0165	0	cause someone's attention, goals, thought to turn in another direction	occupy in an agreeable, entertaining or pleasant fashion.
OnWN	2014	0166	0	The human act of making something new.	the event that occurred at the beginning of something.
OnWN	2014	0167	4.6	move or gather in a hive	move together in a hive or as if in a hive.
OnWN	2014	0168	4	rinse one's mouth with mouthwash, gargle	rinse one's mouth and throat with mouthwash.
OnWN	2014	0169	4.6	Provide or equip specifically with furniture.	provide or equip with furniture.
OnWN	2014	0170	2	Make or create something for a specific function.	make out of components (often in an improvising manner).
OnWN	2014	0171	4.8	lowest employee salary permitted by law	the lowest wage that an employer is allowed to pay; determined by contract or by law.
OnWN	2014	0172	4.2	watery rot on produce caused by fungus	soft watery rot in fruits and vegetables caused by fungi.
OnWN	2014	0173	4.4	room where work or repairs are done	room where work is done.
OnWN	2014	0174	4.4	Sever or remove by pinching or snipping; tend by cutting.	sever or remove by pinching or snipping.
OnWN	2014	0175	2.8	compress out of shape or into small pieces	become injured, broken, or distorted by pressure.
OnWN	2014	0176	4.4	a single tall stone, e.g., obelisk or monument	a single great stone (often in the form of a column or obelisk).
OnWN	2014	0177	4.2	(cause to) gradually become weak	cause to grow thin or weak.
OnWN	2014	0178	4.7	move or execute very quickly or hastily	run or move very quickly or hastily.
OnWN	2014	0179	4.8	Prove or suggest to be false or incorrect.	prove to be false or incorrect.
OnWN	2014	0180	2.8	(cause to) be overlaid with something	provide with a covering or cause to be covered.
OnWN	2014	0181	3.4	carry as a backpack, go backpacking	carry, as on one's back.
OnWN	2014	0182	3.2	(Cause to) separate into constituents, weaken, or destroy specifically by soaking.	separate into constituents by soaking.
OnWN	2014	0183	4.6	GRATE ON: gnaw into emotionally; make resentful or angry.	gnaw into; make resentful or angry.
OnWN	2014	0184	4.6	glare or strike with intensity	glare or strike with great intensity.
OnWN	2014	0185	4.2	rightful portion or stake of something	(law) a right or legal share of something; a financial involvement with something.
OnWN	2014	0186	4.6	Be shiny; be a physical or metaphorical source of light.	shine brightly, like a star or a light.
OnWN	2014	0187	3.6	the rotating motion of an object	rotary motion of an object around its own axis.
OnWN	2014	0188	4.4	a romantic partner, girlfriend or boyfriend	(slang) a person's girlfriend or boyfriend.
OnWN	2014	0189	5	grip, penetrate or tear off with or as if with the teeth or jaws	to grip, cut off, or tear with or as if with the teeth or jaws.
OnWN	2014	0190	1.2	exceed or surpass, go beyond, be greater than something	pass by, over, or under without making contact.
OnWN	2014	0191	4.2	the outermost part of a car or truck wheel	the outer part of a wheel to which the tire is attached.
OnWN	2014	0192	4.4	turn in to get something in exchange	to turn in (vouchers or coupons) and receive something in exchange.
OnWN	2014	0193	5	the act of perceiving a scent	the act of perceiving the odor of something.
OnWN	2014	0194	4.4	relative darkness of a color	relative darkness or lightness of a color.
OnWN	2014	0195	2.8	express or transform in a new form or language	change from one form or medium into another.
OnWN	2014	0196	3.6	freshen, to make fresh; refreshen	become or make oneself fresh again.
OnWN	2014	0197	3.8	a work area for manufacturing or repair work	small workplace where handcrafts or manufacturing are done.
OnWN	2014	0198	4.6	fall between two taxonomic groups	be intermediate between two taxonomic groups.
OnWN	2014	0199	4.6	bubble over with a certain feeling	overflow with a certain feeling.
OnWN	2014	0200	4	scoop up, as if with a ladle	scoop up by plunging one's hand or a ladle below the surface.
OnWN	2014	0201	4.2	The action of opposing some other social or military force.	the military action of resisting the enemy's advance.
OnWN	2014	0202	2.4	Incline or bend; changle configuration.	to incline or bend from a vertical position.
OnWN	2014	0203	4.6	(cause to) spray or wet with a spurt of liquid	wet with a spurt of liquid.
OnWN	2014	0204	4.6	To move (the head or body) quickly downwards or away (from something).	to move (the head or body) quickly downwards or away.
OnWN	2014	0205	3.8	a specified portion of a whole	one of several parts or pieces that fit with others to constitute a whole object.
OnWN	2014	0206	4.4	Join or attach (as if) with glue, possibly to cover the surface of an object.	join or attach with or as if with glue.
OnWN	2014	0207	3.4	move from one location to another	transfer from one place or period to another.
OnWN	2014	0208	4.8	to make a great mental or physical effort	make a great effort at a mental or physical task.
OnWN	2014	0209	3.2	FISHING-exhaust by allowing to pull on the line	exhaust by allowing to pull on the line.
OnWN	2014	0210	4.8	completely use up a resource	use up the whole supply of.
OnWN	2014	0211	4.4	secure and protect a lifeform, maintain from injury or harm	maintain in safety from injury, harm, or danger.
OnWN	2014	0212	2.8	a local non-residential college offering two years of courses	a nonresidential junior college offering a curriculum fitted to the needs of the community.
OnWN	2014	0213	5	Throw a glance at; take a brief look at or examine hastily.	throw a glance at; take a brief look at.
OnWN	2014	0214	4.5	an air force military unit, smaller than a squadron	an air force unit smaller than a squadron.
OnWN	2014	0215	0.4	interfere with someone else's activity	destroy the peace or tranquility of.
OnWN	2014	0216	4.4	assign to or arrange into categories	arrange or order by classes or categories.
OnWN	2014	0217	4.8	be eligible or suitable, meet requirements for/as	prove capable or fit; meet requirements.
OnWN	2014	0218	4.6	Treat a substance with some agent; add an agent to.	treat with an agent; add (an agent) to.
OnWN	2014	0219	4.8	build, make by combining materials or parts	make by combining materials and parts.
OnWN	2014	0220	2.4	make colder, or icy, using ice	cause to become ice or icy.
OnWN	2014	0221	3.5	provide a seat or base for	show to a seat; assign a seat for.
OnWN	2014	0222	4.4	Expose to air as to cool, freshen, or allow to escape.	expose to cool or cold air so as to cool or freshen.
OnWN	2014	0223	5	the act of perpetrating a crime	the act of committing a crime.
