OnWN	2013	0506	1	the identification or the realization of something	the end or completion of something.
OnWN	2013	0507	0.6	the act of concealing or disguising	the act of projecting out from something.
OnWN	2013	0508	3.8	A document granting a right or privilege, as to an inventor.	a document granting an inventor sole rights to an invention.
OnWN	2013	0509	4.6	the central area of an object	the center of an object.
OnWN	2013	0510	0.6	the act of lifting something	the act of colliding with something.
OnWN	2013	0511	0.4	the act of lifting something	the act of decreasing or reducing something.
OnWN	2013	0512	0.4	the act of putting a preparation on something.	the act of stopping something.
OnWN	2013	0513	0.6	the act of advocating or promoting something	the act of rending or ripping or splitting something.
OnWN	2013	0514	4	Have a distinctive or characteristic taste, perceptible by an experiencer.	have a distinctive or characteristic taste.
OnWN	2013	0515	4.2	Be a sign or indication of; have as a meaning.	be a sign or indication of.
OnWN	2013	0516	4.4	the general impression or appearance of something	the general outward appearance of something.
OnWN	2013	0517	4.8	know, realize, and comprehend the meaning	know and comprehend the nature or meaning of.
OnWN	2013	0518	4	Make or create something for a specific function.	make something, usually for a specific function.
OnWN	2013	0519	3	get rid of as if with water (metaphorical)	get rid of as if by submerging.
OnWN	2013	0520	0.6	the act of acknowledging the truth of something	the act of choosing or selecting.
OnWN	2013	0521	4.4	change or conform to fit new or different conditions	adapt or conform oneself to new or different conditions.
OnWN	2013	0522	0	the act of providing incentive to someone	the act of troubling or annoying someone.
OnWN	2013	0523	4	a watch with a hinged lid to protect the face	a watch with a hinged metal lid to protect the crystal.
OnWN	2013	0524	4	support, sustain, bear, or be responsible for	organize or be responsible for.
OnWN	2013	0525	3.2	strive against another or others to attain a goal	compete for something; engage in a contest; measure oneself against others.
OnWN	2013	0526	0.6	The act of testing something.	the act of cracking something.
OnWN	2013	0527	1.6	Gather or remove (from a location) for use.	remove from a position or office.
OnWN	2013	0528	0.2	the act of directing attention, resources to something	the act of colliding with something.
OnWN	2013	0529	4	Ride on someone's shoulders or back; support on the back or shoulders.	ride on someone's shoulders or back.
OnWN	2013	0530	3.4	the act of combining, blending, integrating	the act of mixing together.
OnWN	2013	0531	3.2	a solid 3D object with rectangular sides	a solid piece of something (usually having flat rectangular sides).
OnWN	2013	0532	0.2	the translation of an opus from one language to another	the act of moving from one place to another.
OnWN	2013	0533	0	the act of annoying someone or something	the act of admitting someone to enter.
OnWN	2013	0534	4.4	Write differently or alter a piece or writing, perhaps to suit a different purpose.	rewrite so as to make fit to suit a new or different purpose.
OnWN	2013	0535	4.25	a celebrity or entertainer who attracts a large audience	an entertainer who attracts large audiences.
OnWN	2013	0536	4	Dispose of something as useless and old; physically tear apart.	dispose of (something useless or old).
OnWN	2013	0537	0.4	The state of being absent.	the state of being excommunicated.
OnWN	2013	0538	3.6	rise to surface; become visible or known	appear or become visible; make a showing.
OnWN	2013	0539	0	overcome with astonishment or disbelief	correct by punishment or discipline.
OnWN	2013	0540	3.8	lessen in force or effect, restrain, weaken	lessen in force or effect.
OnWN	2013	0541	0	the act of intentionally omitting something	the act of climbing something.
OnWN	2013	0542	2.2	the act of advocating or promoting something	the act of affirming or asserting or stating something.
OnWN	2013	0543	4.6	a list of items to be consulted and marked off	a list of items (names or tasks etc.) to be checked or consulted.
OnWN	2013	0544	0.6	The act of testing something.	the act of stopping something.
OnWN	2013	0545	3.2	the act of damaging something, causing breakage	the act of damaging something or someone.
OnWN	2013	0546	4.6	put in a particular place or abstract location	put into a certain place or abstract location.
OnWN	2013	0547	4.4	the act of perceiving a scent	the act of perceiving the odor of something.
OnWN	2013	0548	1.8	the act of providing assistance, giving aid	the act of administering medication.
OnWN	2013	0549	4.6	lessen in force, impact, or effect	lessen in force or effect.
OnWN	2013	0550	1.4	cover with wooden boards; secure	get on board of (trains, buses, ships, aircraft, etc.).
OnWN	2013	0551	0	the act of explaining or defending something	the act of removing or getting rid of something.
OnWN	2013	0552	3.8	a lid or top of a container	covering for a hole (especially a hole in the top of a container).
OnWN	2013	0553	4.6	(cause to) separate or move in different directions	to cause to separate and go in different directions.
OnWN	2013	0554	2.4	cause to vibrate in a different pattern	cause to vibrate in a definite pattern.
OnWN	2013	0555	0.8	The act of dividing or disconnecting.	the act of adding one thing to another.
OnWN	2013	0556	4	decide upon or fix definitely/specify	decide upon or fix definitely.
OnWN	2013	0557	1.4	provide a seat or base for	provide a feast or banquet for.
OnWN	2013	0558	0	the act of explaining or defending something	the act of rending or ripping or splitting something.
OnWN	2013	0559	0.4	an observer of a process or activity	a meeting devoted to a particular activity.
OnWN	2013	0560	3.8	make keen; give (new) life or energy to	give new life or energy to.
