plagiarism	2016	0254	0	Occasionally it is advantageous to differentiate between these uses, as it is not necessarily noticeable from context.	It also provides a way to generalize du to the "is a" relationship between classes.	A Corpus of Plagiarised Short Answers - http://ir.shef.ac.uk/cloughie/resources/plagiarism_corpus.html File: g1pD_taska.txt	A Corpus of Plagiarised Short Answers - http://ir.shef.ac.uk/cloughie/resources/plagiarism_corpus.html File: g0pC_taska.txt
plagiarism	2016	0256	4	Construct an optimal solution from computed values.	Define value of optimal solution recursively.	A Corpus of Plagiarised Short Answers - http://ir.shef.ac.uk/cloughie/resources/plagiarism_corpus.html File: g0pA_taske.txt	A Corpus of Plagiarised Short Answers - http://ir.shef.ac.uk/cloughie/resources/plagiarism_corpus.html File: g0pA_taske.txt
plagiarism	2016	0259	0	Occasionally it is advantageous to differentiate between these uses, as it is not necessarily noticeable from context.	It is similar to divide and conquer, however is differentiated as its subproblems are not independent.	A Corpus of Plagiarised Short Answers - http://ir.shef.ac.uk/cloughie/resources/plagiarism_corpus.html File: g1pD_taska.txt	A Corpus of Plagiarised Short Answers - http://ir.shef.ac.uk/cloughie/resources/plagiarism_corpus.html File: g0pD_taske.txt
plagiarism	2016	0263	2	When a document is represented as a vector, each dimension corresponds to a separate term.	The basic idea is to represent each document as a vector of certain weighted word frequencies.	A Corpus of Plagiarised Short Answers - http://ir.shef.ac.uk/cloughie/resources/plagiarism_corpus.html File: g1pB_taskc.txt	A Corpus of Plagiarised Short Answers - http://ir.shef.ac.uk/cloughie/resources/plagiarism_corpus.html File: g4pC_taskc.txt
plagiarism	2016	0264	3	When a document is represented as a vector, each dimension corresponds to a separate term.	Each dimension corresponds to a separate term.	A Corpus of Plagiarised Short Answers - http://ir.shef.ac.uk/cloughie/resources/plagiarism_corpus.html File: g1pB_taskc.txt	A Corpus of Plagiarised Short Answers - http://ir.shef.ac.uk/cloughie/resources/plagiarism_corpus.html File: g1pA_taskc.txt
plagiarism	2016	0265	0	Mathematicians use the word to describe a set of rules which anyone can follow to solve a problem.	However an object cannot be cast to a class which is no relative of it.	A Corpus of Plagiarised Short Answers - http://ir.shef.ac.uk/cloughie/resources/plagiarism_corpus.html File: g4pE_taske.txt	A Corpus of Plagiarised Short Answers - http://ir.shef.ac.uk/cloughie/resources/plagiarism_corpus.html File: g4pB_taska.txt
plagiarism	2016	0270	5	Whilst Bayesians describe probabilities in terms of beliefs and degrees of uncertainty.	At the same time, Bayesians describe probabilities in terms of beliefs and degrees of uncertainty.	A Corpus of Plagiarised Short Answers - http://ir.shef.ac.uk/cloughie/resources/plagiarism_corpus.html File: g2pB_taskd.txt	A Corpus of Plagiarised Short Answers - http://ir.shef.ac.uk/cloughie/resources/plagiarism_corpus.html File: g4pC_taskd.txt
plagiarism	2016	0276	5	It is used in information filtering, information retrieval, indexing and relevancy rankings.	It is used in information filtering, indexing, relevancy rankings and information retrieval.	A Corpus of Plagiarised Short Answers - http://ir.shef.ac.uk/cloughie/resources/plagiarism_corpus.html File: g0pB_taskc.txt	A Corpus of Plagiarised Short Answers - http://ir.shef.ac.uk/cloughie/resources/plagiarism_corpus.html File: g1pB_taskc.txt
plagiarism	2016	0280	1	In probability theory, Bayes' theorem relates the conditional and marginal probabilities of two random events.	Bayes' theorem is useful in evaluating the result of drug tests.	A Corpus of Plagiarised Short Answers - http://ir.shef.ac.uk/cloughie/resources/plagiarism_corpus.html File: g2pC_taskd.txt	A Corpus of Plagiarised Short Answers - http://ir.shef.ac.uk/cloughie/resources/plagiarism_corpus.html File: g3pB_taskd.txt
plagiarism	2016	0283	1	Outbound, links from your page to others.	Dangling, links to a page which has no links to others.	A Corpus of Plagiarised Short Answers - http://ir.shef.ac.uk/cloughie/resources/plagiarism_corpus.html File: g1pB_taskb.txt	A Corpus of Plagiarised Short Answers - http://ir.shef.ac.uk/cloughie/resources/plagiarism_corpus.html File: g1pB_taskb.txt
plagiarism	2016	0289	1	Vector space representation results in the loss of the order which the terms are in the document.	In vector space model, the documents from which the information is to be retrieved are represented as vectors.	A Corpus of Plagiarised Short Answers - http://ir.shef.ac.uk/cloughie/resources/plagiarism_corpus.html File: g1pB_taskc.txt	A Corpus of Plagiarised Short Answers - http://ir.shef.ac.uk/cloughie/resources/plagiarism_corpus.html File: g4pD_taskc.txt
plagiarism	2016	0291	3	In computer science; dynamic programming is a way of solving problems consist of overlapping subproblems and optimal substructure.	However, the key in Dynamic Programming is to determine the structure of optimal solutions.	A Corpus of Plagiarised Short Answers - http://ir.shef.ac.uk/cloughie/resources/plagiarism_corpus.html File: g0pC_taske.txt	A Corpus of Plagiarised Short Answers - http://ir.shef.ac.uk/cloughie/resources/plagiarism_corpus.html File: g0pA_taske.txt
plagiarism	2016	0296	1	If a term appears in the document, the terms value in the vector is non-zero.	Vector space representation results in the loss of the order which the terms are in the document.	A Corpus of Plagiarised Short Answers - http://ir.shef.ac.uk/cloughie/resources/plagiarism_corpus.html File: g2pA_taskc.txt	A Corpus of Plagiarised Short Answers - http://ir.shef.ac.uk/cloughie/resources/plagiarism_corpus.html File: g1pB_taskc.txt
plagiarism	2016	0300	1	In vector space model, the documents from which the information is to be retrieved are represented as vectors.	Finally, the order in which the terms appear in the document is lost in the vector space representation.	A Corpus of Plagiarised Short Answers - http://ir.shef.ac.uk/cloughie/resources/plagiarism_corpus.html File: g4pD_taskc.txt	A Corpus of Plagiarised Short Answers - http://ir.shef.ac.uk/cloughie/resources/plagiarism_corpus.html File: g0pA_taskc.txt
plagiarism	2016	0302	3	For instance, a finalized schedule of events at an exhibition is sometimes called a program.	The typical example could be of a finalized schedule of events at an exhibition.	A Corpus of Plagiarised Short Answers - http://ir.shef.ac.uk/cloughie/resources/plagiarism_corpus.html File: g0pE_taske.txt	A Corpus of Plagiarised Short Answers - http://ir.shef.ac.uk/cloughie/resources/plagiarism_corpus.html File: g4pD_taske.txt
plagiarism	2016	0304	5	Several different ways of computing these values, also known as (term) weights, have been developed.	Several different ways of computing these values, additionally known as (term) weights, have been developed.	A Corpus of Plagiarised Short Answers - http://ir.shef.ac.uk/cloughie/resources/plagiarism_corpus.html File: g0pB_taskc.txt	A Corpus of Plagiarised Short Answers - http://ir.shef.ac.uk/cloughie/resources/plagiarism_corpus.html File: g0pD_taskc.txt
plagiarism	2016	0305	5	If a term exists in a document, its value in the vector is not equal to zero.	If a term appears in the document then its value in the vector is non-zero.	A Corpus of Plagiarised Short Answers - http://ir.shef.ac.uk/cloughie/resources/plagiarism_corpus.html File: g4pB_taskc.txt	A Corpus of Plagiarised Short Answers - http://ir.shef.ac.uk/cloughie/resources/plagiarism_corpus.html File: g0pA_taskc.txt
plagiarism	2016	0312	5	A hyperlink to a page counts as a vote of support.	A link to a page is seen as a vote of support.	A Corpus of Plagiarised Short Answers - http://ir.shef.ac.uk/cloughie/resources/plagiarism_corpus.html File: g4pE_taskb.txt	A Corpus of Plagiarised Short Answers - http://ir.shef.ac.uk/cloughie/resources/plagiarism_corpus.html File: g2pA_taskb.txt
plagiarism	2016	0317	0	This means that inheritance is used when types have common factors and these would be put into the superclass.	The main problem is divided into sub problems which are solved and stored for future use.	A Corpus of Plagiarised Short Answers - http://ir.shef.ac.uk/cloughie/resources/plagiarism_corpus.html File: g2pB_taska.txt	A Corpus of Plagiarised Short Answers - http://ir.shef.ac.uk/cloughie/resources/plagiarism_corpus.html File: g1pD_taske.txt
plagiarism	2016	0320	0	Most of these languages provide an “extend” keyword, which is used to subclass another.	For example, a program could exist to model different forms of transport.	A Corpus of Plagiarised Short Answers - http://ir.shef.ac.uk/cloughie/resources/plagiarism_corpus.html File: g3pA_taska.txt	A Corpus of Plagiarised Short Answers - http://ir.shef.ac.uk/cloughie/resources/plagiarism_corpus.html File: g2pA_taska.txt
plagiarism	2016	0324	5	For instance, a finalized schedule of events at an exhibition is sometimes called a program.	For example, a schedule of events at an exhibition is sometimes called a programme.	A Corpus of Plagiarised Short Answers - http://ir.shef.ac.uk/cloughie/resources/plagiarism_corpus.html File: g0pE_taske.txt	A Corpus of Plagiarised Short Answers - http://ir.shef.ac.uk/cloughie/resources/plagiarism_corpus.html File: g3pC_taske.txt
plagiarism	2016	0332	1	The value of a vector is non-zero if a term occurs in the document.	Each document is a vector where each word is a dimension.	A Corpus of Plagiarised Short Answers - http://ir.shef.ac.uk/cloughie/resources/plagiarism_corpus.html File: g1pA_taskc.txt	A Corpus of Plagiarised Short Answers - http://ir.shef.ac.uk/cloughie/resources/plagiarism_corpus.html File: g0pC_taskc.txt
plagiarism	2016	0335	4	The theorem is often used when we have observations and wish to compute posterior probabilities.	It is often used to calculate posterior probabilities given observations.	A Corpus of Plagiarised Short Answers - http://ir.shef.ac.uk/cloughie/resources/plagiarism_corpus.html File: g3pC_taskd.txt	A Corpus of Plagiarised Short Answers - http://ir.shef.ac.uk/cloughie/resources/plagiarism_corpus.html File: g2pB_taskd.txt
plagiarism	2016	0338	1	Other possible uses for vector space models are indexing and also to rank the relevancy of differing documents.	In this classic model the term specific weights in the document vectors are products of local and global parameters.	A Corpus of Plagiarised Short Answers - http://ir.shef.ac.uk/cloughie/resources/plagiarism_corpus.html File: g2pB_taskc.txt	A Corpus of Plagiarised Short Answers - http://ir.shef.ac.uk/cloughie/resources/plagiarism_corpus.html File: g1pA_taskc.txt
plagiarism	2016	0346	1	The correct answer can be computed using Bayes' theorem.	Bayes' theorem is useful in evaluating the result of drug tests.	A Corpus of Plagiarised Short Answers - http://ir.shef.ac.uk/cloughie/resources/plagiarism_corpus.html File: g2pA_taskd.txt	A Corpus of Plagiarised Short Answers - http://ir.shef.ac.uk/cloughie/resources/plagiarism_corpus.html File: g3pB_taskd.txt
plagiarism	2016	0352	3	• P(B|A) is the conditional probability of B given A.	P(A|B) is the conditional probability of A, given B.	A Corpus of Plagiarised Short Answers - http://ir.shef.ac.uk/cloughie/resources/plagiarism_corpus.html File: g4pC_taskd.txt	A Corpus of Plagiarised Short Answers - http://ir.shef.ac.uk/cloughie/resources/plagiarism_corpus.html File: g2pB_taskd.txt
plagiarism	2016	0365	3	Since the PageRank is the most important algorithms which is used in the Google engine.	The PageRank is a recursive algorithm used by Google to determine which webpages are more important than others.	A Corpus of Plagiarised Short Answers - http://ir.shef.ac.uk/cloughie/resources/plagiarism_corpus.html File: g4pC_taskb.txt	A Corpus of Plagiarised Short Answers - http://ir.shef.ac.uk/cloughie/resources/plagiarism_corpus.html File: g2pC_taskb.txt
plagiarism	2016	0368	5	Nevertheless, the patent is assigned to the University of Stanford and not to Google.	However, the patent is assigned to Stanford University and not to Google.	A Corpus of Plagiarised Short Answers - http://ir.shef.ac.uk/cloughie/resources/plagiarism_corpus.html File: g2pE_taskb.txt	A Corpus of Plagiarised Short Answers - http://ir.shef.ac.uk/cloughie/resources/plagiarism_corpus.html File: g4pE_taskb.txt
plagiarism	2016	0369	0	This means that inheritance is used when types have common factors and these would be put into the superclass.	It is therefore used to create relationships between one object and another.	A Corpus of Plagiarised Short Answers - http://ir.shef.ac.uk/cloughie/resources/plagiarism_corpus.html File: g2pB_taska.txt	A Corpus of Plagiarised Short Answers - http://ir.shef.ac.uk/cloughie/resources/plagiarism_corpus.html File: g1pA_taska.txt
plagiarism	2016	0371	3	In the vector space model a document is represented as a vector.	A document is represented as a vector, and each dimension corresponds to a separate term.	A Corpus of Plagiarised Short Answers - http://ir.shef.ac.uk/cloughie/resources/plagiarism_corpus.html File: g3pB_taskc.txt	A Corpus of Plagiarised Short Answers - http://ir.shef.ac.uk/cloughie/resources/plagiarism_corpus.html File: g0pB_taskc.txt
plagiarism	2016	0372	4	P(B) is the prior or marginal probability of B, and acts to normalise the probability.	P(B) (a.k.a. the normalizing constant) is the prior or marginal probability of B.	A Corpus of Plagiarised Short Answers - http://ir.shef.ac.uk/cloughie/resources/plagiarism_corpus.html File: g0pB_taskd.txt	A Corpus of Plagiarised Short Answers - http://ir.shef.ac.uk/cloughie/resources/plagiarism_corpus.html File: g4pB_taskd.txt
plagiarism	2016	0374	0	This can be useful when the number of times a word appears is not considered important.	The easiest way to look at inheritance is as an “…is a kind of” relationship.	A Corpus of Plagiarised Short Answers - http://ir.shef.ac.uk/cloughie/resources/plagiarism_corpus.html File: g4pD_taskc.txt	A Corpus of Plagiarised Short Answers - http://ir.shef.ac.uk/cloughie/resources/plagiarism_corpus.html File: g1pB_taska.txt
plagiarism	2016	0380	4	In probability theory, Bayes' theorem relates the conditional and marginal probabilities of two random events.	Bayes' theorem relates the conditional and marginal probabilities of two random events.	A Corpus of Plagiarised Short Answers - http://ir.shef.ac.uk/cloughie/resources/plagiarism_corpus.html File: g2pC_taskd.txt	A Corpus of Plagiarised Short Answers - http://ir.shef.ac.uk/cloughie/resources/plagiarism_corpus.html File: g0pB_taskd.txt
plagiarism	2016	0382	5	The definition of term depends on the application.	The definition of a term depends on the application.	A Corpus of Plagiarised Short Answers - http://ir.shef.ac.uk/cloughie/resources/plagiarism_corpus.html File: g0pB_taskc.txt	A Corpus of Plagiarised Short Answers - http://ir.shef.ac.uk/cloughie/resources/plagiarism_corpus.html File: g2pA_taskc.txt
plagiarism	2016	0383	2	Break up the problem different smaller subproblems.	A problem with overlapping subproblems means that the same subproblems may be used to solve many different larger problems.	A Corpus of Plagiarised Short Answers - http://ir.shef.ac.uk/cloughie/resources/plagiarism_corpus.html File: g0pB_taske.txt	A Corpus of Plagiarised Short Answers - http://ir.shef.ac.uk/cloughie/resources/plagiarism_corpus.html File: g2pC_taske.txt
plagiarism	2016	0385	5	Inheritance is a method of forming new classes using predefined classes.	Inheritance in object oriented programming is a way to form new classes using classes that have already been defined.	A Corpus of Plagiarised Short Answers - http://ir.shef.ac.uk/cloughie/resources/plagiarism_corpus.html File: g1pD_taska.txt	A Corpus of Plagiarised Short Answers - http://ir.shef.ac.uk/cloughie/resources/plagiarism_corpus.html File: g0pD_taska.txt
plagiarism	2016	0392	3	So the same rule applies with keywords and indeed longer phrases.	Single words, keywords and occasionally longer phrases are used for terms.	A Corpus of Plagiarised Short Answers - http://ir.shef.ac.uk/cloughie/resources/plagiarism_corpus.html File: g0pD_taskc.txt	A Corpus of Plagiarised Short Answers - http://ir.shef.ac.uk/cloughie/resources/plagiarism_corpus.html File: g1pB_taskc.txt
plagiarism	2016	0399	0	There is also Conditional Probability which is usually interested in the way variables relate to each other.	The PageRank is a recursive algorithm used by Google to determine which webpages are more important than others.	A Corpus of Plagiarised Short Answers - http://ir.shef.ac.uk/cloughie/resources/plagiarism_corpus.html File: g2pE_taskd.txt	A Corpus of Plagiarised Short Answers - http://ir.shef.ac.uk/cloughie/resources/plagiarism_corpus.html File: g2pC_taskb.txt
plagiarism	2016	0403	5	Thus, the program is the best plan for action that is produced.	Thus, the "program" is the optimal plan for action that is produced.	A Corpus of Plagiarised Short Answers - http://ir.shef.ac.uk/cloughie/resources/plagiarism_corpus.html File: g0pC_taske.txt	A Corpus of Plagiarised Short Answers - http://ir.shef.ac.uk/cloughie/resources/plagiarism_corpus.html File: g0pE_taske.txt
plagiarism	2016	0419	3	Inheritance is a basic concept in object oriented programming.	Inheritance in object oriented programming is a way to form new classes using classes that have already been defined.	A Corpus of Plagiarised Short Answers - http://ir.shef.ac.uk/cloughie/resources/plagiarism_corpus.html File: g0pB_taska.txt	A Corpus of Plagiarised Short Answers - http://ir.shef.ac.uk/cloughie/resources/plagiarism_corpus.html File: g0pD_taska.txt
plagiarism	2016	0429	4	Programming, in this sense, means finding an acceptable plan of action.	Programming, in this sense, means finding an acceptable plan, an algorithm.	A Corpus of Plagiarised Short Answers - http://ir.shef.ac.uk/cloughie/resources/plagiarism_corpus.html File: g3pB_taske.txt	A Corpus of Plagiarised Short Answers - http://ir.shef.ac.uk/cloughie/resources/plagiarism_corpus.html File: g3pC_taske.txt
plagiarism	2016	0430	4	The vector space model has some limitations: 1.	The vector space model has several disadvantages.	A Corpus of Plagiarised Short Answers - http://ir.shef.ac.uk/cloughie/resources/plagiarism_corpus.html File: g2pA_taskc.txt	A Corpus of Plagiarised Short Answers - http://ir.shef.ac.uk/cloughie/resources/plagiarism_corpus.html File: g0pA_taskc.txt
plagiarism	2016	0433	4	Using the vector space model for Information Retrieval models all pages and queries as high-dimensional sparse vectors.	A possible use for a vector space model is for retrieval and filtering of information.	A Corpus of Plagiarised Short Answers - http://ir.shef.ac.uk/cloughie/resources/plagiarism_corpus.html File: g3pC_taskc.txt	A Corpus of Plagiarised Short Answers - http://ir.shef.ac.uk/cloughie/resources/plagiarism_corpus.html File: g2pB_taskc.txt
plagiarism	2016	0435	4	One of the most famous schemes is tf-idf weighting.	One of the best known schemes is tf-idf (term frequency-inverse document frequency) weighting.	A Corpus of Plagiarised Short Answers - http://ir.shef.ac.uk/cloughie/resources/plagiarism_corpus.html File: g0pD_taskc.txt	A Corpus of Plagiarised Short Answers - http://ir.shef.ac.uk/cloughie/resources/plagiarism_corpus.html File: g1pA_taskc.txt
plagiarism	2016	0443	3	A document is represented as a vector, with each dimension corresponding to a separate term.	A document has representation as a vector.	A Corpus of Plagiarised Short Answers - http://ir.shef.ac.uk/cloughie/resources/plagiarism_corpus.html File: g3pA_taskc.txt	A Corpus of Plagiarised Short Answers - http://ir.shef.ac.uk/cloughie/resources/plagiarism_corpus.html File: g0pD_taskc.txt
plagiarism	2016	0444	4	Vector space representation results in the loss of the order which the terms are in the document.	The order in which terms appear in the document is lost in a vector space representation.	A Corpus of Plagiarised Short Answers - http://ir.shef.ac.uk/cloughie/resources/plagiarism_corpus.html File: g1pB_taskc.txt	A Corpus of Plagiarised Short Answers - http://ir.shef.ac.uk/cloughie/resources/plagiarism_corpus.html File: g2pA_taskc.txt
plagiarism	2016	0455	2	P(A) is the probability of the student being a girl (which is 2/5).	What is the probability this student is a girl?	A Corpus of Plagiarised Short Answers - http://ir.shef.ac.uk/cloughie/resources/plagiarism_corpus.html File: g2pC_taskd.txt	A Corpus of Plagiarised Short Answers - http://ir.shef.ac.uk/cloughie/resources/plagiarism_corpus.html File: g2pA_taskd.txt
plagiarism	2016	0458	1	The basic idea is to represent each document as a vector of certain weighted word frequencies.	If a term appears in the document, the terms value in the vector is non-zero.	A Corpus of Plagiarised Short Answers - http://ir.shef.ac.uk/cloughie/resources/plagiarism_corpus.html File: g4pC_taskc.txt	A Corpus of Plagiarised Short Answers - http://ir.shef.ac.uk/cloughie/resources/plagiarism_corpus.html File: g2pA_taskc.txt
plagiarism	2016	0459	5	Therefore, the "program" is the optimal plan for action that is produced.	The "program" is the optimal plan for action that is produced.	A Corpus of Plagiarised Short Answers - http://ir.shef.ac.uk/cloughie/resources/plagiarism_corpus.html File: g4pC_taske.txt	A Corpus of Plagiarised Short Answers - http://ir.shef.ac.uk/cloughie/resources/plagiarism_corpus.html File: g3pB_taske.txt
plagiarism	2016	0463	2	This is highly used in dynamic programming.	There are four steps in Dynamic Programming: 1.	A Corpus of Plagiarised Short Answers - http://ir.shef.ac.uk/cloughie/resources/plagiarism_corpus.html File: g4pD_taske.txt	A Corpus of Plagiarised Short Answers - http://ir.shef.ac.uk/cloughie/resources/plagiarism_corpus.html File: g0pA_taske.txt
plagiarism	2016	0465	4	Other ways of computing these values, or weights, have been developed.	Many different methods of calculating these values, sometimes known as (term) weights, have been developed.	A Corpus of Plagiarised Short Answers - http://ir.shef.ac.uk/cloughie/resources/plagiarism_corpus.html File: g1pB_taskc.txt	A Corpus of Plagiarised Short Answers - http://ir.shef.ac.uk/cloughie/resources/plagiarism_corpus.html File: g2pA_taskc.txt
plagiarism	2016	0470	4	It is usually be used to compute posterior probabilities given observations.	It is used to compute posterior probabilities given observations.	A Corpus of Plagiarised Short Answers - http://ir.shef.ac.uk/cloughie/resources/plagiarism_corpus.html File: g4pC_taskd.txt	A Corpus of Plagiarised Short Answers - http://ir.shef.ac.uk/cloughie/resources/plagiarism_corpus.html File: g0pC_taskd.txt
plagiarism	2016	0472	3	In probability theory, Bayes' theorem relates the conditional and marginal probabilities of two random events.	Bayes Theorem is a mathematical formula used to calculate conditional probabilities.	A Corpus of Plagiarised Short Answers - http://ir.shef.ac.uk/cloughie/resources/plagiarism_corpus.html File: g2pC_taskd.txt	A Corpus of Plagiarised Short Answers - http://ir.shef.ac.uk/cloughie/resources/plagiarism_corpus.html File: g1pD_taskd.txt
plagiarism	2016	0475	1	P(B) is the prior or marginal probability of B, and acts as a normalizing constant.	P(B|A) is the conditional probability of B given A.	A Corpus of Plagiarised Short Answers - http://ir.shef.ac.uk/cloughie/resources/plagiarism_corpus.html File: g3pA_taskd.txt	A Corpus of Plagiarised Short Answers - http://ir.shef.ac.uk/cloughie/resources/plagiarism_corpus.html File: g0pB_taskd.txt
plagiarism	2016	0476	3	A website’s page rank, is how ‘important’ it is on the web.	A variation of the PageRank method bases the importance of a webpage on how many visits the page gets.	A Corpus of Plagiarised Short Answers - http://ir.shef.ac.uk/cloughie/resources/plagiarism_corpus.html File: g1pB_taskb.txt	A Corpus of Plagiarised Short Answers - http://ir.shef.ac.uk/cloughie/resources/plagiarism_corpus.html File: g2pC_taskb.txt
plagiarism	2016	0483	4	In computer science; dynamic programming is a way of solving problems consist of overlapping subproblems and optimal substructure.	Dynamic Programming is a very powerful mathematical technique, often utilised in programming, for solving optimization problems.	A Corpus of Plagiarised Short Answers - http://ir.shef.ac.uk/cloughie/resources/plagiarism_corpus.html File: g0pC_taske.txt	A Corpus of Plagiarised Short Answers - http://ir.shef.ac.uk/cloughie/resources/plagiarism_corpus.html File: g2pA_taske.txt
plagiarism	2016	0489	4	The most popular is tf-idf weighting.	One of the most famous schemes is tf-idf weighting.	A Corpus of Plagiarised Short Answers - http://ir.shef.ac.uk/cloughie/resources/plagiarism_corpus.html File: g1pB_taskc.txt	A Corpus of Plagiarised Short Answers - http://ir.shef.ac.uk/cloughie/resources/plagiarism_corpus.html File: g0pD_taskc.txt
plagiarism	2016	0495	1	This method is used in the Google Toolbar, which reports back actual site visits to Google.	In order to prevent spamming, Google releases little information on the way in which a PageRank is calculated.	A Corpus of Plagiarised Short Answers - http://ir.shef.ac.uk/cloughie/resources/plagiarism_corpus.html File: g0pB_taskb.txt	A Corpus of Plagiarised Short Answers - http://ir.shef.ac.uk/cloughie/resources/plagiarism_corpus.html File: g2pA_taskb.txt
plagiarism	2016	0502	0	To achieve this, the programmer has to note generalisations and similarities about various aspects of the program.	Mathematicians use the word to describe a set of rules which anyone can follow to solve a problem.	A Corpus of Plagiarised Short Answers - http://ir.shef.ac.uk/cloughie/resources/plagiarism_corpus.html File: g2pA_taska.txt	A Corpus of Plagiarised Short Answers - http://ir.shef.ac.uk/cloughie/resources/plagiarism_corpus.html File: g4pE_taske.txt
