plagiarism	2016	0849	1	The order in which the terms appear in the document is lost in the vector space representation.	If the term doesn’t occur within the document, the value in the vector is zero.	A Corpus of Plagiarised Short Answers - http://ir.shef.ac.uk/cloughie/resources/plagiarism_corpus.html File: orig_taskc.txt	A Corpus of Plagiarised Short Answers - http://ir.shef.ac.uk/cloughie/resources/plagiarism_corpus.html File: g3pB_taskc.txt
plagiarism	2016	0859	5	Since it is a formal theorem, Bayes' theorem holds in all popular interpretations of probability.	As a formal theorem, Bayes' theorem is valid in all common interpretations of probability.	A Corpus of Plagiarised Short Answers - http://ir.shef.ac.uk/cloughie/resources/plagiarism_corpus.html File: g4pB_taskd.txt	A Corpus of Plagiarised Short Answers - http://ir.shef.ac.uk/cloughie/resources/plagiarism_corpus.html File: g2pA_taskd.txt
plagiarism	2016	0876	5	The methodology takes much less time rather than naive methods.	The method is more effiecent than naive methods.	A Corpus of Plagiarised Short Answers - http://ir.shef.ac.uk/cloughie/resources/plagiarism_corpus.html File: g4pC_taske.txt	A Corpus of Plagiarised Short Answers - http://ir.shef.ac.uk/cloughie/resources/plagiarism_corpus.html File: g0pC_taske.txt
plagiarism	2016	0880	4	The most popular is tf-idf weighting.	One of the best known schemes is tf-idf (term frequency-inverse document frequency) weighting.	A Corpus of Plagiarised Short Answers - http://ir.shef.ac.uk/cloughie/resources/plagiarism_corpus.html File: g1pB_taskc.txt	A Corpus of Plagiarised Short Answers - http://ir.shef.ac.uk/cloughie/resources/plagiarism_corpus.html File: g1pA_taskc.txt
plagiarism	2016	0882	0	This means that inheritance is used when types have common factors and these would be put into the superclass.	This can be useful when the number of times a word appears is not considered important.	A Corpus of Plagiarised Short Answers - http://ir.shef.ac.uk/cloughie/resources/plagiarism_corpus.html File: g2pB_taska.txt	A Corpus of Plagiarised Short Answers - http://ir.shef.ac.uk/cloughie/resources/plagiarism_corpus.html File: g4pD_taskc.txt
plagiarism	2016	0900	3	The value of a vector is non-zero if a term occurs in the document.	If the term doesn’t occur within the document, the value in the vector is zero.	A Corpus of Plagiarised Short Answers - http://ir.shef.ac.uk/cloughie/resources/plagiarism_corpus.html File: g1pA_taskc.txt	A Corpus of Plagiarised Short Answers - http://ir.shef.ac.uk/cloughie/resources/plagiarism_corpus.html File: g3pB_taskc.txt
plagiarism	2016	0901	1	The value of a vector is non-zero if a term occurs in the document.	The order in which the terms appear in the document is lost in the vector space representation.	A Corpus of Plagiarised Short Answers - http://ir.shef.ac.uk/cloughie/resources/plagiarism_corpus.html File: g1pA_taskc.txt	A Corpus of Plagiarised Short Answers - http://ir.shef.ac.uk/cloughie/resources/plagiarism_corpus.html File: orig_taskc.txt
plagiarism	2016	0910	0	The way that a 'term' is defined depends on the application.	The easiest way to look at inheritance is as an “…is a kind of” relationship.	A Corpus of Plagiarised Short Answers - http://ir.shef.ac.uk/cloughie/resources/plagiarism_corpus.html File: g3pA_taskc.txt	A Corpus of Plagiarised Short Answers - http://ir.shef.ac.uk/cloughie/resources/plagiarism_corpus.html File: g1pB_taska.txt
plagiarism	2016	0917	1	The similarity measures largely identify the retrieval efficiency of a particular information retrieval system.	It is used in information retrieval and was first used in the SMART Information Retrieval System.	A Corpus of Plagiarised Short Answers - http://ir.shef.ac.uk/cloughie/resources/plagiarism_corpus.html File: g4pD_taskc.txt	A Corpus of Plagiarised Short Answers - http://ir.shef.ac.uk/cloughie/resources/plagiarism_corpus.html File: g0pA_taskc.txt
plagiarism	2016	0918	5	Typically terms are keywords, single words or longer phrases.	Single words, keywords and occasionally longer phrases are used for terms.	A Corpus of Plagiarised Short Answers - http://ir.shef.ac.uk/cloughie/resources/plagiarism_corpus.html File: g4pB_taskc.txt	A Corpus of Plagiarised Short Answers - http://ir.shef.ac.uk/cloughie/resources/plagiarism_corpus.html File: g1pB_taskc.txt
plagiarism	2016	0921	1	The vector space model is one of these methods, and it is an algebraic model.	The vector space model has the following limitations: 1.	A Corpus of Plagiarised Short Answers - http://ir.shef.ac.uk/cloughie/resources/plagiarism_corpus.html File: g3pB_taskc.txt	A Corpus of Plagiarised Short Answers - http://ir.shef.ac.uk/cloughie/resources/plagiarism_corpus.html File: orig_taskc.txt
plagiarism	2016	0924	0	Therefore, the "program" is the optimal plan for action that is produced.	Since the PageRank is the most important algorithms which is used in the Google engine.	A Corpus of Plagiarised Short Answers - http://ir.shef.ac.uk/cloughie/resources/plagiarism_corpus.html File: g4pC_taske.txt	A Corpus of Plagiarised Short Answers - http://ir.shef.ac.uk/cloughie/resources/plagiarism_corpus.html File: g4pC_taskb.txt
plagiarism	2016	0925	1	• P(A|B) is the conditional probability of A, given B.	P(B) (a.k.a. the normalizing constant) is the prior or marginal probability of B.	A Corpus of Plagiarised Short Answers - http://ir.shef.ac.uk/cloughie/resources/plagiarism_corpus.html File: g4pC_taskd.txt	A Corpus of Plagiarised Short Answers - http://ir.shef.ac.uk/cloughie/resources/plagiarism_corpus.html File: g4pB_taskd.txt
plagiarism	2016	0926	5	Construct an optimal solution from computed values.	Generate the optimal solution of these computed values	A Corpus of Plagiarised Short Answers - http://ir.shef.ac.uk/cloughie/resources/plagiarism_corpus.html File: g0pA_taske.txt	A Corpus of Plagiarised Short Answers - http://ir.shef.ac.uk/cloughie/resources/plagiarism_corpus.html File: g2pA_taske.txt
plagiarism	2016	0933	4	The theorem is often used when we have observations and wish to compute posterior probabilities.	It is usually be used to compute posterior probabilities given observations.	A Corpus of Plagiarised Short Answers - http://ir.shef.ac.uk/cloughie/resources/plagiarism_corpus.html File: g3pC_taskd.txt	A Corpus of Plagiarised Short Answers - http://ir.shef.ac.uk/cloughie/resources/plagiarism_corpus.html File: g4pC_taskd.txt
plagiarism	2016	0938	1	Generalise the structure of an optimal solution 2.	Use these optimal solutions to construct an optimal solution for the original problem.	A Corpus of Plagiarised Short Answers - http://ir.shef.ac.uk/cloughie/resources/plagiarism_corpus.html File: g2pA_taske.txt	A Corpus of Plagiarised Short Answers - http://ir.shef.ac.uk/cloughie/resources/plagiarism_corpus.html File: g2pB_taske.txt
plagiarism	2016	0940	1	The vector space model is one of these methods, and it is an algebraic model.	The vector space model has several disadvantages.	A Corpus of Plagiarised Short Answers - http://ir.shef.ac.uk/cloughie/resources/plagiarism_corpus.html File: g3pB_taskc.txt	A Corpus of Plagiarised Short Answers - http://ir.shef.ac.uk/cloughie/resources/plagiarism_corpus.html File: g0pA_taskc.txt
plagiarism	2016	0943	1	If the term doesn’t occur within the document, the value in the vector is zero.	Finally, the order in which the terms appear in the document is lost in the vector space representation.	A Corpus of Plagiarised Short Answers - http://ir.shef.ac.uk/cloughie/resources/plagiarism_corpus.html File: g3pB_taskc.txt	A Corpus of Plagiarised Short Answers - http://ir.shef.ac.uk/cloughie/resources/plagiarism_corpus.html File: g0pA_taskc.txt
plagiarism	2016	0947	3	When a document is represented as a vector, each dimension corresponds to a separate term.	In the vector space model a document is represented as a vector.	A Corpus of Plagiarised Short Answers - http://ir.shef.ac.uk/cloughie/resources/plagiarism_corpus.html File: g1pB_taskc.txt	A Corpus of Plagiarised Short Answers - http://ir.shef.ac.uk/cloughie/resources/plagiarism_corpus.html File: g3pB_taskc.txt
plagiarism	2016	0951	4	Overlapping subproblems means that the same subproblems are used to solve many different larger problems.	A problem with overlapping subproblems means that the same subproblems may be used to solve many different larger problems.	A Corpus of Plagiarised Short Answers - http://ir.shef.ac.uk/cloughie/resources/plagiarism_corpus.html File: g4pD_taske.txt	A Corpus of Plagiarised Short Answers - http://ir.shef.ac.uk/cloughie/resources/plagiarism_corpus.html File: g2pC_taske.txt
plagiarism	2016	0979	2	The differing application has a direct influence on what the definition of the term means.	Terms are basically the words or any indexing unit used to identify the contents of a text.	A Corpus of Plagiarised Short Answers - http://ir.shef.ac.uk/cloughie/resources/plagiarism_corpus.html File: g2pB_taskc.txt	A Corpus of Plagiarised Short Answers - http://ir.shef.ac.uk/cloughie/resources/plagiarism_corpus.html File: g4pD_taskc.txt
plagiarism	2016	0980	4	The differing application has a direct influence on what the definition of the term means.	The definition of term is dependent on the application.	A Corpus of Plagiarised Short Answers - http://ir.shef.ac.uk/cloughie/resources/plagiarism_corpus.html File: g2pB_taskc.txt	A Corpus of Plagiarised Short Answers - http://ir.shef.ac.uk/cloughie/resources/plagiarism_corpus.html File: g4pB_taskc.txt
plagiarism	2016	0983	3	Inheritance is an important feature in object orientated programming.	The peropos of inheritance in object oriented programming is to minimize the reuse of existing code without modification.	A Corpus of Plagiarised Short Answers - http://ir.shef.ac.uk/cloughie/resources/plagiarism_corpus.html File: g2pB_taska.txt	A Corpus of Plagiarised Short Answers - http://ir.shef.ac.uk/cloughie/resources/plagiarism_corpus.html File: g0pC_taska.txt
plagiarism	2016	0988	1	In probability theory, the prior and conditional probabilities of two random events are related by Bayes' theorem.	Bayes' Theorem is a theorem of probability theory originally stated by the Reverend Thomas Bayes.	A Corpus of Plagiarised Short Answers - http://ir.shef.ac.uk/cloughie/resources/plagiarism_corpus.html File: g3pC_taskd.txt	A Corpus of Plagiarised Short Answers - http://ir.shef.ac.uk/cloughie/resources/plagiarism_corpus.html File: g4pD_taskd.txt
plagiarism	2016	0990	0	Without a proof of correctness, such an algorithm is likely to fail.	However an object cannot be cast to a class which is no relative of it.	A Corpus of Plagiarised Short Answers - http://ir.shef.ac.uk/cloughie/resources/plagiarism_corpus.html File: g2pA_taske.txt	A Corpus of Plagiarised Short Answers - http://ir.shef.ac.uk/cloughie/resources/plagiarism_corpus.html File: g4pB_taska.txt
plagiarism	2016	0995	3	So in essence it is a popularity contest between WebPages.	It is essentially a popularity meter.	A Corpus of Plagiarised Short Answers - http://ir.shef.ac.uk/cloughie/resources/plagiarism_corpus.html File: g2pB_taskb.txt	A Corpus of Plagiarised Short Answers - http://ir.shef.ac.uk/cloughie/resources/plagiarism_corpus.html File: g1pB_taskb.txt
plagiarism	2016	0996	5	Several different ways of computing these values, additionally known as (term) weights, have been developed.	Several different ways have been developed of calculating these values (also known as term weights).	A Corpus of Plagiarised Short Answers - http://ir.shef.ac.uk/cloughie/resources/plagiarism_corpus.html File: g0pD_taskc.txt	A Corpus of Plagiarised Short Answers - http://ir.shef.ac.uk/cloughie/resources/plagiarism_corpus.html File: g1pA_taskc.txt
plagiarism	2016	1000	0	The other method is the top down approach which is a method that combines memorization and recursion.	Since the PageRank is the most important algorithms which is used in the Google engine.	A Corpus of Plagiarised Short Answers - http://ir.shef.ac.uk/cloughie/resources/plagiarism_corpus.html File: g1pD_taske.txt	A Corpus of Plagiarised Short Answers - http://ir.shef.ac.uk/cloughie/resources/plagiarism_corpus.html File: g4pC_taskb.txt
plagiarism	2016	1004	1	The order in which terms appear in the document is lost in a vector space representation.	If a term occurs in the document, the value will be non-zero in the vector.	A Corpus of Plagiarised Short Answers - http://ir.shef.ac.uk/cloughie/resources/plagiarism_corpus.html File: g2pA_taskc.txt	A Corpus of Plagiarised Short Answers - http://ir.shef.ac.uk/cloughie/resources/plagiarism_corpus.html File: g3pA_taskc.txt
plagiarism	2016	1016	4	The method takes much less time than naive methods.	And thus the method takes much less time than more naive methods.	A Corpus of Plagiarised Short Answers - http://ir.shef.ac.uk/cloughie/resources/plagiarism_corpus.html File: g0pE_taske.txt	A Corpus of Plagiarised Short Answers - http://ir.shef.ac.uk/cloughie/resources/plagiarism_corpus.html File: g3pC_taske.txt
plagiarism	2016	1036	1	Inheritance is one of the basic concepts of Object Oriented Programming.	In object oriented programming inheritance is also dependant on access level modifiers.	A Corpus of Plagiarised Short Answers - http://ir.shef.ac.uk/cloughie/resources/plagiarism_corpus.html File: g1pB_taska.txt	A Corpus of Plagiarised Short Answers - http://ir.shef.ac.uk/cloughie/resources/plagiarism_corpus.html File: g4pB_taska.txt
plagiarism	2016	1038	2	As a formal theorem, Bayes' theorem is valid in all common interpretations of probability.	Bayes theorem can be used to compute the probability that a proposed diagnosis is correct.	A Corpus of Plagiarised Short Answers - http://ir.shef.ac.uk/cloughie/resources/plagiarism_corpus.html File: g2pA_taskd.txt	A Corpus of Plagiarised Short Answers - http://ir.shef.ac.uk/cloughie/resources/plagiarism_corpus.html File: g0pC_taskd.txt
plagiarism	2016	1056	0	Thus, the program is the best plan for action that is produced.	After this, it is using this to pick the best overall path.	A Corpus of Plagiarised Short Answers - http://ir.shef.ac.uk/cloughie/resources/plagiarism_corpus.html File: g0pC_taske.txt	A Corpus of Plagiarised Short Answers - http://ir.shef.ac.uk/cloughie/resources/plagiarism_corpus.html File: g4pC_taske.txt
plagiarism	2016	1059	3	The basic idea is to represent each document as a vector of certain weighted word frequencies.	In the vector space model a document is represented as a vector.	A Corpus of Plagiarised Short Answers - http://ir.shef.ac.uk/cloughie/resources/plagiarism_corpus.html File: g4pC_taskc.txt	A Corpus of Plagiarised Short Answers - http://ir.shef.ac.uk/cloughie/resources/plagiarism_corpus.html File: g3pB_taskc.txt
plagiarism	2016	1061	3	Object oriented programming is a style of programming that supports encapsulation, inheritance, and polymorphism.	Inheritance is a basic concept in object oriented programming.	A Corpus of Plagiarised Short Answers - http://ir.shef.ac.uk/cloughie/resources/plagiarism_corpus.html File: g4pE_taska.txt	A Corpus of Plagiarised Short Answers - http://ir.shef.ac.uk/cloughie/resources/plagiarism_corpus.html File: g0pB_taska.txt
plagiarism	2016	1066	3	The vector space model has some limitations: 1.	The limitations of the vector space model are thus.	A Corpus of Plagiarised Short Answers - http://ir.shef.ac.uk/cloughie/resources/plagiarism_corpus.html File: g2pA_taskc.txt	A Corpus of Plagiarised Short Answers - http://ir.shef.ac.uk/cloughie/resources/plagiarism_corpus.html File: g1pB_taskc.txt
plagiarism	2016	1074	2	It is mainly used to calculate the probability of one event’s outcome given that a previous event happened.	It is also called the posterior probability because it is derived from or depends upon the specified value of B.	A Corpus of Plagiarised Short Answers - http://ir.shef.ac.uk/cloughie/resources/plagiarism_corpus.html File: g1pB_taskd.txt	A Corpus of Plagiarised Short Answers - http://ir.shef.ac.uk/cloughie/resources/plagiarism_corpus.html File: g3pA_taskd.txt
plagiarism	2016	1096	3	The theorem is often used when we have observations and wish to compute posterior probabilities.	Bayes theorem can be used to compute the probability that a proposed diagnosis is correct.	A Corpus of Plagiarised Short Answers - http://ir.shef.ac.uk/cloughie/resources/plagiarism_corpus.html File: g3pC_taskd.txt	A Corpus of Plagiarised Short Answers - http://ir.shef.ac.uk/cloughie/resources/plagiarism_corpus.html File: g0pC_taskd.txt
plagiarism	2016	1113	0	This can be useful when the number of times a word appears is not considered important.	It has no relationship to computer programming; instead it is a process of finding a satisfactory algorithm.	A Corpus of Plagiarised Short Answers - http://ir.shef.ac.uk/cloughie/resources/plagiarism_corpus.html File: g4pD_taskc.txt	A Corpus of Plagiarised Short Answers - http://ir.shef.ac.uk/cloughie/resources/plagiarism_corpus.html File: g1pD_taske.txt
plagiarism	2016	1114	4	In probability theory, Bayes' theorem relates the conditional and marginal probabilities of two random events.	In probability theory, the prior and conditional probabilities of two random events are related by Bayes' theorem.	A Corpus of Plagiarised Short Answers - http://ir.shef.ac.uk/cloughie/resources/plagiarism_corpus.html File: g2pC_taskd.txt	A Corpus of Plagiarised Short Answers - http://ir.shef.ac.uk/cloughie/resources/plagiarism_corpus.html File: g3pC_taskd.txt
plagiarism	2016	1122	3	One of the best known schemes is tf-idf weighting (see the example below).	One of the best known schemes is tf-idf weighting, proposed by Salton, Wong and Yang.	A Corpus of Plagiarised Short Answers - http://ir.shef.ac.uk/cloughie/resources/plagiarism_corpus.html File: orig_taskc.txt	A Corpus of Plagiarised Short Answers - http://ir.shef.ac.uk/cloughie/resources/plagiarism_corpus.html File: g0pB_taskc.txt
plagiarism	2016	1125	3	It is therefore used to create relationships between one object and another.	It also provides a way to generalize du to the "is a" relationship between classes.	A Corpus of Plagiarised Short Answers - http://ir.shef.ac.uk/cloughie/resources/plagiarism_corpus.html File: g1pA_taska.txt	A Corpus of Plagiarised Short Answers - http://ir.shef.ac.uk/cloughie/resources/plagiarism_corpus.html File: g0pC_taska.txt
plagiarism	2016	1126	0	Then, using this, the best overall path can be found, thereby demonstrating the dynamic programming principle.	The further down an inheritance tree you get, the more specific the classes become.	A Corpus of Plagiarised Short Answers - http://ir.shef.ac.uk/cloughie/resources/plagiarism_corpus.html File: g0pB_taske.txt	A Corpus of Plagiarised Short Answers - http://ir.shef.ac.uk/cloughie/resources/plagiarism_corpus.html File: g1pB_taska.txt
plagiarism	2016	1154	3	When a document is represented as a vector, each dimension corresponds to a separate term.	A document has representation as a vector.	A Corpus of Plagiarised Short Answers - http://ir.shef.ac.uk/cloughie/resources/plagiarism_corpus.html File: g1pB_taskc.txt	A Corpus of Plagiarised Short Answers - http://ir.shef.ac.uk/cloughie/resources/plagiarism_corpus.html File: g0pD_taskc.txt
plagiarism	2016	1184	0	To achieve this, the programmer has to note generalisations and similarities about various aspects of the program.	It is similar to divide and conquer, however is differentiated as its subproblems are not independent.	A Corpus of Plagiarised Short Answers - http://ir.shef.ac.uk/cloughie/resources/plagiarism_corpus.html File: g2pA_taska.txt	A Corpus of Plagiarised Short Answers - http://ir.shef.ac.uk/cloughie/resources/plagiarism_corpus.html File: g0pD_taske.txt
plagiarism	2016	1194	0	The further down an inheritance tree you get, the more specific the classes become.	The differing application has a direct influence on what the definition of the term means.	A Corpus of Plagiarised Short Answers - http://ir.shef.ac.uk/cloughie/resources/plagiarism_corpus.html File: g1pB_taska.txt	A Corpus of Plagiarised Short Answers - http://ir.shef.ac.uk/cloughie/resources/plagiarism_corpus.html File: g2pB_taskc.txt
plagiarism	2016	1199	2	The algebraic model for representing text documents and objects as vectors of identifiers is called the vector space model.	The limitations of the vector space model are thus.	A Corpus of Plagiarised Short Answers - http://ir.shef.ac.uk/cloughie/resources/plagiarism_corpus.html File: g1pB_taskc.txt	A Corpus of Plagiarised Short Answers - http://ir.shef.ac.uk/cloughie/resources/plagiarism_corpus.html File: g1pB_taskc.txt
plagiarism	2016	1221	5	In general, dynamic programming is used on optimisation problems, where the most efficient solution is needed.	However, the key in Dynamic Programming is to determine the structure of optimal solutions.	A Corpus of Plagiarised Short Answers - http://ir.shef.ac.uk/cloughie/resources/plagiarism_corpus.html File: g3pA_taske.txt	A Corpus of Plagiarised Short Answers - http://ir.shef.ac.uk/cloughie/resources/plagiarism_corpus.html File: g0pA_taske.txt
plagiarism	2016	1223	2	It is used in information filtering, information retrieval, indexing and relevancy rankings.	A possible use for a vector space model is for retrieval and filtering of information.	A Corpus of Plagiarised Short Answers - http://ir.shef.ac.uk/cloughie/resources/plagiarism_corpus.html File: g0pB_taskc.txt	A Corpus of Plagiarised Short Answers - http://ir.shef.ac.uk/cloughie/resources/plagiarism_corpus.html File: g2pB_taskc.txt
plagiarism	2016	1232	0	The easiest way to look at inheritance is as an “…is a kind of” relationship.	It also provides a way to generalize du to the "is a" relationship between classes.	A Corpus of Plagiarised Short Answers - http://ir.shef.ac.uk/cloughie/resources/plagiarism_corpus.html File: g1pB_taska.txt	A Corpus of Plagiarised Short Answers - http://ir.shef.ac.uk/cloughie/resources/plagiarism_corpus.html File: g0pC_taska.txt
plagiarism	2016	1240	0	This means that inheritance is used when types have common factors and these would be put into the superclass.	It is "prior" in the sense that it does not take into account any information about B.	A Corpus of Plagiarised Short Answers - http://ir.shef.ac.uk/cloughie/resources/plagiarism_corpus.html File: g2pB_taska.txt	A Corpus of Plagiarised Short Answers - http://ir.shef.ac.uk/cloughie/resources/plagiarism_corpus.html File: g3pA_taskd.txt
plagiarism	2016	1247	0	This means that inheritance is used when types have common factors and these would be put into the superclass.	The method can be abused when people deliberately link to sites in order to raise a site's PageRank.	A Corpus of Plagiarised Short Answers - http://ir.shef.ac.uk/cloughie/resources/plagiarism_corpus.html File: g2pB_taska.txt	A Corpus of Plagiarised Short Answers - http://ir.shef.ac.uk/cloughie/resources/plagiarism_corpus.html File: g2pC_taskb.txt
