plagiarism	2016	0505	4	Construct an optimal solution from computed values.	The last point would be to construct an optimal solution from the computed values.	A Corpus of Plagiarised Short Answers - http://ir.shef.ac.uk/cloughie/resources/plagiarism_corpus.html File: g0pA_taske.txt	A Corpus of Plagiarised Short Answers - http://ir.shef.ac.uk/cloughie/resources/plagiarism_corpus.html File: g2pE_taske.txt
plagiarism	2016	0510	3	If the term doesn’t occur within the document, the value in the vector is zero.	If a term appears in the document, the terms value in the vector is non-zero.	A Corpus of Plagiarised Short Answers - http://ir.shef.ac.uk/cloughie/resources/plagiarism_corpus.html File: g3pB_taskc.txt	A Corpus of Plagiarised Short Answers - http://ir.shef.ac.uk/cloughie/resources/plagiarism_corpus.html File: g2pA_taskc.txt
plagiarism	2016	0512	4	This is a much quicker method than other more naive methods.	The method takes much less time than naive methods.	A Corpus of Plagiarised Short Answers - http://ir.shef.ac.uk/cloughie/resources/plagiarism_corpus.html File: g0pB_taske.txt	A Corpus of Plagiarised Short Answers - http://ir.shef.ac.uk/cloughie/resources/plagiarism_corpus.html File: g0pE_taske.txt
plagiarism	2016	0517	1	P(B) is the prior or marginal probability of B, and acts to normalise the probability.	P(A), or the probability that the student is a girl regardless of any other information.	A Corpus of Plagiarised Short Answers - http://ir.shef.ac.uk/cloughie/resources/plagiarism_corpus.html File: g0pB_taskd.txt	A Corpus of Plagiarised Short Answers - http://ir.shef.ac.uk/cloughie/resources/plagiarism_corpus.html File: g2pA_taskd.txt
plagiarism	2016	0518	4	Inheritance in object oriented programming is a way to form new classes using classes that have already been defined.	inheritance in object oriented programming is where a new class is formed using classes which have allready been defined.	A Corpus of Plagiarised Short Answers - http://ir.shef.ac.uk/cloughie/resources/plagiarism_corpus.html File: g0pD_taska.txt	A Corpus of Plagiarised Short Answers - http://ir.shef.ac.uk/cloughie/resources/plagiarism_corpus.html File: g0pC_taska.txt
plagiarism	2016	0522	3	They also inherit the attributes and methods of its superclass.	The new classes are called derived classes and they inherit the behaviours and attributes of the base classes.	A Corpus of Plagiarised Short Answers - http://ir.shef.ac.uk/cloughie/resources/plagiarism_corpus.html File: g4pB_taska.txt	A Corpus of Plagiarised Short Answers - http://ir.shef.ac.uk/cloughie/resources/plagiarism_corpus.html File: g1pD_taska.txt
plagiarism	2016	0524	2	A term which occurs in the document has a value in the vector of non-zero.	A document is represented as a vector, with each dimension corresponding to a separate term.	A Corpus of Plagiarised Short Answers - http://ir.shef.ac.uk/cloughie/resources/plagiarism_corpus.html File: g1pB_taskc.txt	A Corpus of Plagiarised Short Answers - http://ir.shef.ac.uk/cloughie/resources/plagiarism_corpus.html File: g3pA_taskc.txt
plagiarism	2016	0526	5	If a term appears in the document, the terms value in the vector is non-zero.	A term which occurs in the document has a value in the vector of non-zero.	A Corpus of Plagiarised Short Answers - http://ir.shef.ac.uk/cloughie/resources/plagiarism_corpus.html File: g2pA_taskc.txt	A Corpus of Plagiarised Short Answers - http://ir.shef.ac.uk/cloughie/resources/plagiarism_corpus.html File: g1pB_taskc.txt
plagiarism	2016	0534	1	The order in which terms appear in the document is lost in a vector space representation.	In vector space model, the documents from which the information is to be retrieved are represented as vectors.	A Corpus of Plagiarised Short Answers - http://ir.shef.ac.uk/cloughie/resources/plagiarism_corpus.html File: g2pA_taskc.txt	A Corpus of Plagiarised Short Answers - http://ir.shef.ac.uk/cloughie/resources/plagiarism_corpus.html File: g4pD_taskc.txt
plagiarism	2016	0535	5	The vector space model has some limitations: 1.	LIMITATION: There is some limitation of vector space model.	A Corpus of Plagiarised Short Answers - http://ir.shef.ac.uk/cloughie/resources/plagiarism_corpus.html File: g2pA_taskc.txt	A Corpus of Plagiarised Short Answers - http://ir.shef.ac.uk/cloughie/resources/plagiarism_corpus.html File: g4pE_taskc.txt
plagiarism	2016	0539	4	However, the vector space model has limitations.	The limitations of the vector space model are thus.	A Corpus of Plagiarised Short Answers - http://ir.shef.ac.uk/cloughie/resources/plagiarism_corpus.html File: g3pA_taskc.txt	A Corpus of Plagiarised Short Answers - http://ir.shef.ac.uk/cloughie/resources/plagiarism_corpus.html File: g1pB_taskc.txt
plagiarism	2016	0546	0	The method can be abused when people deliberately link to sites in order to raise a site's PageRank.	Mathematicians use the word to describe a set of rules which anyone can follow to solve a problem.	A Corpus of Plagiarised Short Answers - http://ir.shef.ac.uk/cloughie/resources/plagiarism_corpus.html File: g2pC_taskb.txt	A Corpus of Plagiarised Short Answers - http://ir.shef.ac.uk/cloughie/resources/plagiarism_corpus.html File: g4pE_taske.txt
plagiarism	2016	0548	2	When a document is represented as a vector, each dimension corresponds to a separate term.	To explain further vector space models, basically a document is characterized by a vector.	A Corpus of Plagiarised Short Answers - http://ir.shef.ac.uk/cloughie/resources/plagiarism_corpus.html File: g1pB_taskc.txt	A Corpus of Plagiarised Short Answers - http://ir.shef.ac.uk/cloughie/resources/plagiarism_corpus.html File: g2pB_taskc.txt
plagiarism	2016	0571	1	The basic idea is to represent each document as a vector of certain weighted word frequencies.	A term which occurs in the document has a value in the vector of non-zero.	A Corpus of Plagiarised Short Answers - http://ir.shef.ac.uk/cloughie/resources/plagiarism_corpus.html File: g4pC_taskc.txt	A Corpus of Plagiarised Short Answers - http://ir.shef.ac.uk/cloughie/resources/plagiarism_corpus.html File: g1pB_taskc.txt
plagiarism	2016	0573	4	Programming, in this sense, means finding an acceptable plan of action.	Programming means finding a plan of action.	A Corpus of Plagiarised Short Answers - http://ir.shef.ac.uk/cloughie/resources/plagiarism_corpus.html File: g3pB_taske.txt	A Corpus of Plagiarised Short Answers - http://ir.shef.ac.uk/cloughie/resources/plagiarism_corpus.html File: g0pC_taske.txt
plagiarism	2016	0586	0	Google’s payoff is that it gets to track the behaviour of actual users.	After this, it is using this to pick the best overall path.	A Corpus of Plagiarised Short Answers - http://ir.shef.ac.uk/cloughie/resources/plagiarism_corpus.html File: g3pB_taskb.txt	A Corpus of Plagiarised Short Answers - http://ir.shef.ac.uk/cloughie/resources/plagiarism_corpus.html File: g4pC_taske.txt
plagiarism	2016	0593	0	This means that inheritance is used when types have common factors and these would be put into the superclass.	There is also Conditional Probability which is usually interested in the way variables relate to each other.	A Corpus of Plagiarised Short Answers - http://ir.shef.ac.uk/cloughie/resources/plagiarism_corpus.html File: g2pB_taska.txt	A Corpus of Plagiarised Short Answers - http://ir.shef.ac.uk/cloughie/resources/plagiarism_corpus.html File: g2pE_taskd.txt
plagiarism	2016	0594	3	Bayes’ theorem was names after Rev Thomas Bayes and is a method used in probability theory.	As a formal theorem Bayes theorem is valid in all common interpretations of probability.	A Corpus of Plagiarised Short Answers - http://ir.shef.ac.uk/cloughie/resources/plagiarism_corpus.html File: g0pA_taskd.txt	A Corpus of Plagiarised Short Answers - http://ir.shef.ac.uk/cloughie/resources/plagiarism_corpus.html File: g0pC_taskd.txt
plagiarism	2016	0619	4	Dynamic Programming solves problems by combining the solutions of subproblems.	The key to Dynamic Programming is to find the structure of optimal solutions.	A Corpus of Plagiarised Short Answers - http://ir.shef.ac.uk/cloughie/resources/plagiarism_corpus.html File: g2pA_taske.txt	A Corpus of Plagiarised Short Answers - http://ir.shef.ac.uk/cloughie/resources/plagiarism_corpus.html File: g2pA_taske.txt
plagiarism	2016	0620	2	Terms are basically the words or any indexing unit used to identify the contents of a text.	In this classic model the term specific weights in the document vectors are products of local and global parameters.	A Corpus of Plagiarised Short Answers - http://ir.shef.ac.uk/cloughie/resources/plagiarism_corpus.html File: g4pD_taskc.txt	A Corpus of Plagiarised Short Answers - http://ir.shef.ac.uk/cloughie/resources/plagiarism_corpus.html File: g1pA_taskc.txt
plagiarism	2016	0622	2	The vector space model are the documents which are represented as “bags of words”.	In vector space model, the documents from which the information is to be retrieved are represented as vectors.	A Corpus of Plagiarised Short Answers - http://ir.shef.ac.uk/cloughie/resources/plagiarism_corpus.html File: g4pC_taskc.txt	A Corpus of Plagiarised Short Answers - http://ir.shef.ac.uk/cloughie/resources/plagiarism_corpus.html File: g4pD_taskc.txt
plagiarism	2016	0627	0	Thus, the "program" is the optimal plan of action that is being produced.	The easiest way to look at inheritance is as an “…is a kind of” relationship.	A Corpus of Plagiarised Short Answers - http://ir.shef.ac.uk/cloughie/resources/plagiarism_corpus.html File: g3pC_taske.txt	A Corpus of Plagiarised Short Answers - http://ir.shef.ac.uk/cloughie/resources/plagiarism_corpus.html File: g1pB_taska.txt
plagiarism	2016	0637	0	To achieve this, the programmer has to note generalisations and similarities about various aspects of the program.	The advantage being the less time consumption in comparison to other amateur methods.	A Corpus of Plagiarised Short Answers - http://ir.shef.ac.uk/cloughie/resources/plagiarism_corpus.html File: g2pA_taska.txt	A Corpus of Plagiarised Short Answers - http://ir.shef.ac.uk/cloughie/resources/plagiarism_corpus.html File: g4pD_taske.txt
plagiarism	2016	0658	4	Subclasses are said to extend or specialise their superclasses.	Subclasses are said to ‘extend’ superclasses.	A Corpus of Plagiarised Short Answers - http://ir.shef.ac.uk/cloughie/resources/plagiarism_corpus.html File: g3pB_taska.txt	A Corpus of Plagiarised Short Answers - http://ir.shef.ac.uk/cloughie/resources/plagiarism_corpus.html File: g1pA_taska.txt
plagiarism	2016	0673	3	It is also called the posterior probability because it is derived from or depends upon the specified value of B.	It is also called the subsequent probability because it is derived from or depends upon the specified value of B.	A Corpus of Plagiarised Short Answers - http://ir.shef.ac.uk/cloughie/resources/plagiarism_corpus.html File: g3pA_taskd.txt	A Corpus of Plagiarised Short Answers - http://ir.shef.ac.uk/cloughie/resources/plagiarism_corpus.html File: g2pB_taskd.txt
plagiarism	2016	0679	0	This can be useful when the number of times a word appears is not considered important.	It is mainly used to calculate the probability of one event’s outcome given that a previous event happened.	A Corpus of Plagiarised Short Answers - http://ir.shef.ac.uk/cloughie/resources/plagiarism_corpus.html File: g4pD_taskc.txt	A Corpus of Plagiarised Short Answers - http://ir.shef.ac.uk/cloughie/resources/plagiarism_corpus.html File: g1pB_taskd.txt
plagiarism	2016	0683	1	Java allows object inheritance.	Inheritance is one of the basic concepts of Object Oriented Programming.	A Corpus of Plagiarised Short Answers - http://ir.shef.ac.uk/cloughie/resources/plagiarism_corpus.html File: g0pB_taska.txt	A Corpus of Plagiarised Short Answers - http://ir.shef.ac.uk/cloughie/resources/plagiarism_corpus.html File: g1pB_taska.txt
plagiarism	2016	0692	0	Mathematicians use the word to describe a set of rules which anyone can follow to solve a problem.	Instead, a new object is made to inherit properties of objects which already exist.	A Corpus of Plagiarised Short Answers - http://ir.shef.ac.uk/cloughie/resources/plagiarism_corpus.html File: g4pE_taske.txt	A Corpus of Plagiarised Short Answers - http://ir.shef.ac.uk/cloughie/resources/plagiarism_corpus.html File: g1pA_taska.txt
plagiarism	2016	0696	1	Virtual attributes and methods can be shadowed/overridden.	In Java all attributes and methods are implicitly virtual.	A Corpus of Plagiarised Short Answers - http://ir.shef.ac.uk/cloughie/resources/plagiarism_corpus.html File: g4pB_taska.txt	A Corpus of Plagiarised Short Answers - http://ir.shef.ac.uk/cloughie/resources/plagiarism_corpus.html File: g4pB_taska.txt
plagiarism	2016	0707	3	One of the best known schemes is tf-idf weighting, proposed by Salton, Wong and Yang.	tf-idf weighting is one of the most well known schemes.	A Corpus of Plagiarised Short Answers - http://ir.shef.ac.uk/cloughie/resources/plagiarism_corpus.html File: g0pB_taskc.txt	A Corpus of Plagiarised Short Answers - http://ir.shef.ac.uk/cloughie/resources/plagiarism_corpus.html File: g2pA_taskc.txt
plagiarism	2016	0713	1	In the vector space model a document is represented as a vector.	The vector space model are the documents which are represented as “bags of words”.	A Corpus of Plagiarised Short Answers - http://ir.shef.ac.uk/cloughie/resources/plagiarism_corpus.html File: g3pB_taskc.txt	A Corpus of Plagiarised Short Answers - http://ir.shef.ac.uk/cloughie/resources/plagiarism_corpus.html File: g4pC_taskc.txt
plagiarism	2016	0718	3	The vector space model has the following limitations: 1.	LIMITATION: There is some limitation of vector space model.	A Corpus of Plagiarised Short Answers - http://ir.shef.ac.uk/cloughie/resources/plagiarism_corpus.html File: orig_taskc.txt	A Corpus of Plagiarised Short Answers - http://ir.shef.ac.uk/cloughie/resources/plagiarism_corpus.html File: g4pE_taskc.txt
plagiarism	2016	0724	3	It is intended to help reuse existing code with little or no modification.	The idea of inheritance is to reuse the existing code with little or no modification at all.	A Corpus of Plagiarised Short Answers - http://ir.shef.ac.uk/cloughie/resources/plagiarism_corpus.html File: g0pE_taska.txt	A Corpus of Plagiarised Short Answers - http://ir.shef.ac.uk/cloughie/resources/plagiarism_corpus.html File: g4pD_taska.txt
plagiarism	2016	0728	4	It is often used to compute posterior probabilities given observations.	The theorem is often used when we have observations and wish to compute posterior probabilities.	A Corpus of Plagiarised Short Answers - http://ir.shef.ac.uk/cloughie/resources/plagiarism_corpus.html File: g2pA_taskd.txt	A Corpus of Plagiarised Short Answers - http://ir.shef.ac.uk/cloughie/resources/plagiarism_corpus.html File: g3pC_taskd.txt
plagiarism	2016	0732	2	When any sub-problem is met again, it can be found and re-used to solve another problem.	It was intended to allow existing code to be used again with minimal or no alteration.	A Corpus of Plagiarised Short Answers - http://ir.shef.ac.uk/cloughie/resources/plagiarism_corpus.html File: g1pA_taske.txt	A Corpus of Plagiarised Short Answers - http://ir.shef.ac.uk/cloughie/resources/plagiarism_corpus.html File: g1pD_taska.txt
plagiarism	2016	0733	1	The peropos of inheritance in object oriented programming is to minimize the reuse of existing code without modification.	In object oriented programming inheritance is also dependant on access level modifiers.	A Corpus of Plagiarised Short Answers - http://ir.shef.ac.uk/cloughie/resources/plagiarism_corpus.html File: g0pC_taska.txt	A Corpus of Plagiarised Short Answers - http://ir.shef.ac.uk/cloughie/resources/plagiarism_corpus.html File: g4pB_taska.txt
plagiarism	2016	0742	4	Every dimension is precisely related to a separate term.	Each and every dimension corresponds to a separate term.	A Corpus of Plagiarised Short Answers - http://ir.shef.ac.uk/cloughie/resources/plagiarism_corpus.html File: g0pD_taskc.txt	A Corpus of Plagiarised Short Answers - http://ir.shef.ac.uk/cloughie/resources/plagiarism_corpus.html File: g4pB_taskc.txt
plagiarism	2016	0744	0	The other method is the top down approach which is a method that combines memorization and recursion.	The easiest way to look at inheritance is as an “…is a kind of” relationship.	A Corpus of Plagiarised Short Answers - http://ir.shef.ac.uk/cloughie/resources/plagiarism_corpus.html File: g1pD_taske.txt	A Corpus of Plagiarised Short Answers - http://ir.shef.ac.uk/cloughie/resources/plagiarism_corpus.html File: g1pB_taska.txt
plagiarism	2016	0747	0	P(A), or the probability that the student is a girl regardless of any other information.	Later versions of PageRank (see the below formulas) would assume a probability distribution between 0 and 1.	A Corpus of Plagiarised Short Answers - http://ir.shef.ac.uk/cloughie/resources/plagiarism_corpus.html File: g2pA_taskd.txt	A Corpus of Plagiarised Short Answers - http://ir.shef.ac.uk/cloughie/resources/plagiarism_corpus.html File: g4pD_taskb.txt
plagiarism	2016	0748	1	When a document is represented as a vector, each dimension corresponds to a separate term.	The value of a vector is non-zero if a term occurs in the document.	A Corpus of Plagiarised Short Answers - http://ir.shef.ac.uk/cloughie/resources/plagiarism_corpus.html File: g1pB_taskc.txt	A Corpus of Plagiarised Short Answers - http://ir.shef.ac.uk/cloughie/resources/plagiarism_corpus.html File: g1pA_taskc.txt
plagiarism	2016	0750	0	To achieve this, the programmer has to note generalisations and similarities about various aspects of the program.	Terms are basically the words or any indexing unit used to identify the contents of a text.	A Corpus of Plagiarised Short Answers - http://ir.shef.ac.uk/cloughie/resources/plagiarism_corpus.html File: g2pA_taska.txt	A Corpus of Plagiarised Short Answers - http://ir.shef.ac.uk/cloughie/resources/plagiarism_corpus.html File: g4pD_taskc.txt
plagiarism	2016	0752	2	The vector space model are the documents which are represented as “bags of words”.	The limitations of the vector space model are thus.	A Corpus of Plagiarised Short Answers - http://ir.shef.ac.uk/cloughie/resources/plagiarism_corpus.html File: g4pC_taskc.txt	A Corpus of Plagiarised Short Answers - http://ir.shef.ac.uk/cloughie/resources/plagiarism_corpus.html File: g1pB_taskc.txt
plagiarism	2016	0761	1	The vector space model is one of these methods, and it is an algebraic model.	In vector space model, the documents from which the information is to be retrieved are represented as vectors.	A Corpus of Plagiarised Short Answers - http://ir.shef.ac.uk/cloughie/resources/plagiarism_corpus.html File: g3pB_taskc.txt	A Corpus of Plagiarised Short Answers - http://ir.shef.ac.uk/cloughie/resources/plagiarism_corpus.html File: g4pD_taskc.txt
plagiarism	2016	0766	5	The vector space model has the following limitations: 1.	The vector space model has some limitations: 1.	A Corpus of Plagiarised Short Answers - http://ir.shef.ac.uk/cloughie/resources/plagiarism_corpus.html File: orig_taskc.txt	A Corpus of Plagiarised Short Answers - http://ir.shef.ac.uk/cloughie/resources/plagiarism_corpus.html File: g2pA_taskc.txt
plagiarism	2016	0772	0	However an object cannot be cast to a class which is no relative of it.	Here by meaning that a program can be an optimal plan for the produced action.	A Corpus of Plagiarised Short Answers - http://ir.shef.ac.uk/cloughie/resources/plagiarism_corpus.html File: g4pB_taska.txt	A Corpus of Plagiarised Short Answers - http://ir.shef.ac.uk/cloughie/resources/plagiarism_corpus.html File: g4pD_taske.txt
plagiarism	2016	0774	3	The vector is then constucted of the frequency of eacher word (dimension).	The basic idea is to represent each document as a vector of certain weighted word frequencies.	A Corpus of Plagiarised Short Answers - http://ir.shef.ac.uk/cloughie/resources/plagiarism_corpus.html File: g0pC_taskc.txt	A Corpus of Plagiarised Short Answers - http://ir.shef.ac.uk/cloughie/resources/plagiarism_corpus.html File: g4pC_taskc.txt
plagiarism	2016	0775	5	Typically terms are single words, keywords, or longer phrases.	Typically terms are keywords, single words or longer phrases.	A Corpus of Plagiarised Short Answers - http://ir.shef.ac.uk/cloughie/resources/plagiarism_corpus.html File: g0pB_taskc.txt	A Corpus of Plagiarised Short Answers - http://ir.shef.ac.uk/cloughie/resources/plagiarism_corpus.html File: g4pB_taskc.txt
plagiarism	2016	0785	5	It does not take into account any information about B and therefore is considered “prior”.	It doesn't take into account any information about B, so it is "prior".	A Corpus of Plagiarised Short Answers - http://ir.shef.ac.uk/cloughie/resources/plagiarism_corpus.html File: g4pB_taskd.txt	A Corpus of Plagiarised Short Answers - http://ir.shef.ac.uk/cloughie/resources/plagiarism_corpus.html File: g0pB_taskd.txt
plagiarism	2016	0790	3	The PageRank depends on the PageRank rating and number of all pages that have links to it.	of a particular page is roughly based upon the quantity of inbound links as well as the PageRank?	A Corpus of Plagiarised Short Answers - http://ir.shef.ac.uk/cloughie/resources/plagiarism_corpus.html File: g2pA_taskb.txt	A Corpus of Plagiarised Short Answers - http://ir.shef.ac.uk/cloughie/resources/plagiarism_corpus.html File: g0pA_taskb.txt
plagiarism	2016	0791	4	Construct an optimal solution from computed values.	Use these optimal solutions to construct an optimal solution for the original problem.	A Corpus of Plagiarised Short Answers - http://ir.shef.ac.uk/cloughie/resources/plagiarism_corpus.html File: g0pA_taske.txt	A Corpus of Plagiarised Short Answers - http://ir.shef.ac.uk/cloughie/resources/plagiarism_corpus.html File: g2pB_taske.txt
plagiarism	2016	0795	3	Single words, keywords and occasionally longer phrases are used for terms.	The number of unique words in the vocabulary denotes the dimensionality, if words are used for the terms.	A Corpus of Plagiarised Short Answers - http://ir.shef.ac.uk/cloughie/resources/plagiarism_corpus.html File: g1pB_taskc.txt	A Corpus of Plagiarised Short Answers - http://ir.shef.ac.uk/cloughie/resources/plagiarism_corpus.html File: g2pB_taskc.txt
plagiarism	2016	0804	1	The vector space model has several disadvantages.	A document has representation as a vector.	A Corpus of Plagiarised Short Answers - http://ir.shef.ac.uk/cloughie/resources/plagiarism_corpus.html File: g0pA_taskc.txt	A Corpus of Plagiarised Short Answers - http://ir.shef.ac.uk/cloughie/resources/plagiarism_corpus.html File: g0pD_taskc.txt
plagiarism	2016	0806	4	Every dimension is precisely related to a separate term.	A document is represented as a vector, with each dimension corresponding to a separate term.	A Corpus of Plagiarised Short Answers - http://ir.shef.ac.uk/cloughie/resources/plagiarism_corpus.html File: g0pD_taskc.txt	A Corpus of Plagiarised Short Answers - http://ir.shef.ac.uk/cloughie/resources/plagiarism_corpus.html File: g3pA_taskc.txt
plagiarism	2016	0824	0	This means that inheritance is used when types have common factors and these would be put into the superclass.	Occasionally it is advantageous to differentiate between these uses, as it is not necessarily noticeable from context.	A Corpus of Plagiarised Short Answers - http://ir.shef.ac.uk/cloughie/resources/plagiarism_corpus.html File: g2pB_taska.txt	A Corpus of Plagiarised Short Answers - http://ir.shef.ac.uk/cloughie/resources/plagiarism_corpus.html File: g1pD_taska.txt
plagiarism	2016	0829	2	This is highly used in dynamic programming.	The key to Dynamic Programming is to find the structure of optimal solutions.	A Corpus of Plagiarised Short Answers - http://ir.shef.ac.uk/cloughie/resources/plagiarism_corpus.html File: g4pD_taske.txt	A Corpus of Plagiarised Short Answers - http://ir.shef.ac.uk/cloughie/resources/plagiarism_corpus.html File: g2pA_taske.txt
plagiarism	2016	0830	3	The idea of inheritance is to reuse the existing code with little or no modification at all.	The idea of inheritance in OOP refers to the formation of new classes with the already existing classes.	A Corpus of Plagiarised Short Answers - http://ir.shef.ac.uk/cloughie/resources/plagiarism_corpus.html File: g4pD_taska.txt	A Corpus of Plagiarised Short Answers - http://ir.shef.ac.uk/cloughie/resources/plagiarism_corpus.html File: g4pD_taska.txt
plagiarism	2016	0844	1	The peropos of inheritance in object oriented programming is to minimize the reuse of existing code without modification.	However, the key in Dynamic Programming is to determine the structure of optimal solutions.	A Corpus of Plagiarised Short Answers - http://ir.shef.ac.uk/cloughie/resources/plagiarism_corpus.html File: g0pC_taska.txt	A Corpus of Plagiarised Short Answers - http://ir.shef.ac.uk/cloughie/resources/plagiarism_corpus.html File: g0pA_taske.txt
plagiarism	2016	0845	5	A document is represented as a vector and each dimension corresponds to a separate term.	When a document is represented as a vector, each dimension corresponds to a separate term.	A Corpus of Plagiarised Short Answers - http://ir.shef.ac.uk/cloughie/resources/plagiarism_corpus.html File: g0pA_taskc.txt	A Corpus of Plagiarised Short Answers - http://ir.shef.ac.uk/cloughie/resources/plagiarism_corpus.html File: g1pB_taskc.txt
plagiarism	2016	0848	3	It is valid in all common interpretations of probability.	As an official theorem, Bayes' theorem is valid in all universal interpretations of probability.	A Corpus of Plagiarised Short Answers - http://ir.shef.ac.uk/cloughie/resources/plagiarism_corpus.html File: g1pA_taskd.txt	A Corpus of Plagiarised Short Answers - http://ir.shef.ac.uk/cloughie/resources/plagiarism_corpus.html File: g2pB_taskd.txt
