surprise.OnWN	2012test	0639	4.750	make or become thick	make thick or thicker.
surprise.OnWN	2012test	0640	4.750	move or execute very quickly or hastily	run or move very quickly or hastily.
surprise.OnWN	2012test	0641	4.000	hurt, feel physical pain	feel physical pain.
surprise.OnWN	2012test	0642	4.250	tell or spread rumors; say	tell or spread rumors.
surprise.OnWN	2012test	0643	4.250	throw with force or recklessness; cast away	throw with force or recklessness.
surprise.OnWN	2012test	0644	4.500	return to in thought or speech	return in thought or speech to something.
surprise.OnWN	2012test	0645	4.250	Try to cure by special care    or treatment, of an illness or injury; treat carefully.	try to cure by special care of treatment, of an illness or injury.
surprise.OnWN	2012test	0646	4.250	a sweeping cut with a sharp instrument	a strong sweeping cut made with a sharp instrument.
surprise.OnWN	2012test	0647	4.500	Any address at which one dwells more than temporarily.	any address at which you dwell more than temporarily.
surprise.OnWN	2012test	0648	4.750	BOTANY -- the usually underground organ of a plant that lacks buds or leaves or nodes, which absorbs water and mineral salts; usually it anchors the plant to the ground.	(botany) the usually underground organ that lacks buds or leaves or nodes; absorbs water and mineral salts; usually it anchors the plant to the ground.
surprise.OnWN	2012test	0649	3.750	Reproduce or make an exact copy of; make,    do, or perform again.	reproduce or make an exact copy of.
surprise.OnWN	2012test	0650	4.500	pass (a thread) through or into,on or as if on a    string	thread on or as if on a string.
surprise.OnWN	2012test	0651	4.500	Engrave by means of dots.	engrave by means of dots and flicks.
surprise.OnWN	2012test	0652	4.750	have a strong desire to do something	have a strong desire or urge to do something.
surprise.OnWN	2012test	0653	4.500	be relevant or pertinent	be pertinent or relevant or applicable.
surprise.OnWN	2012test	0654	4.000	indicate contempt by breathing noisily and    forcefully through the news	indicate contempt by breathing noisily and forcefully through the nose.
surprise.OnWN	2012test	0655	5.000	become aware of through the senses	to become aware of through the senses.
surprise.OnWN	2012test	0656	4.500	cause to be alert or energetic	cause to be alert and energetic.
surprise.OnWN	2012test	0657	4.500	Remove by erasing or crossing out, as if by    drawing a line through.	remove by erasing or crossing out or as if by drawing a line.
surprise.OnWN	2012test	0658	5.000	cook slowly for a long time in liquid	cook slowly and for a long time in liquid.
surprise.OnWN	2012test	0659	3.750	the temperature at which a liquid boils, bubbles	the temperature at which a liquid boils at sea level.
surprise.OnWN	2012test	0660	3.750	Make a map of; show or establish the    features or details of; explore or survey for the purposes of making a    map.	make a map of; show or establish the features of details of.
surprise.OnWN	2012test	0661	5.000	The social force that binds one to the courses of action demanded by that force.	the social force that binds you to the courses of action demanded by that force.
surprise.OnWN	2012test	0662	4.250	Avoid or try to avoid fulfilling,          answering, or performing.	avoid or try to avoid fulfilling, answering, or performing (duties, questions, or issues).
surprise.OnWN	2012test	0663	4.750	Lead someone in the wrong direction  (physically); give wrong spatial directions.	lead someone in the wrong direction or give someone wrong directions.
surprise.OnWN	2012test	0664	4.250	maintain, assert, or claim	maintain or assert.
surprise.OnWN	2012test	0665	4.500	Improve by restoring to a previous or better condition.	restore to a previous or better condition.
surprise.OnWN	2012test	0666	4.750	make accessible to some action, influence, or condition	expose or make accessible to some action or influence.
surprise.OnWN	2012test	0667	4.000	Approach a limit as the number of terms          increases without limit; specifically a mathematical term.	approach a limit as the number of terms increases without limit.
surprise.OnWN	2012test	0668	5.000	The stiching that forms the rim of a shoe or boot.	the stitching that forms the rim of a shoe or boot.
surprise.OnWN	2012test	0669	4.750	put under the control of the federal government	put under the control and authority of a federal government.
surprise.OnWN	2012test	0670	5.000	Manual stimulation fo the genital area for sexual pleasure.	manual stimulation of the genital area for sexual pleasure.
surprise.OnWN	2012test	0671	4.250	equip with a fuse	equip with a fuse; provide with a fuse.
surprise.OnWN	2012test	0672	4.750	end of the American Revolution	the successful ending of the American Revolution.
surprise.OnWN	2012test	0673	5.000	(mathematics) The smallest whole number or a numeral representing this number.	the smallest whole number or a numeral representing this number.
surprise.OnWN	2012test	0674	4.500	stimulating or demanding factors of a situation	a demanding or stimulating situation.
surprise.OnWN	2012test	0675	4.500	A physical portion of all or part of a natural object that is collected and preserved as an example of its class or total.	all or part of a natural object that is collected and preserved as an example of its class.
surprise.OnWN	2012test	0676	5.000	Amplify an electron current by causing part          of the power on the output circuit to act upon the input circuit.	amplify (an electron current) by causing part of the power in the output circuit to act upon the input circuit.
surprise.OnWN	2012test	0677	3.250	A human utters words loudly and forcefully.	utter words loudly and forcefully.
surprise.OnWN	2012test	0678	5.000	oppose with equal weight or force	contrast with equal weight or force.
surprise.OnWN	2012test	0679	5.000	(Cause to) strike the air in flight.	strike the air in flight.
surprise.OnWN	2012test	0680	5.000	Preserve in a tin or jar.	preserve in a can or tin.
surprise.OnWN	2012test	0681	5.000	a chain of atoms in a molecule forming a closed loop	(chemistry) a chain of atoms in a molecule that forms a closed loop.
surprise.OnWN	2012test	0682	5.000	make the surface level or smooth	make the surface of level or smooth.
surprise.OnWN	2012test	0683	4.750	Impress or affect deeply (emotionally).	impress or affect deeply.
surprise.OnWN	2012test	0684	4.750	Supply with a constant flow of some liquid,          for the purpose of cooling, cleansing, or disinfecting.	supply with a constant flow or sprinkling of some liquid, for the purpose of cooling, cleansing, or disinfecting.
surprise.OnWN	2012test	0685	4.750	apply a thin coating of paint/metal	apply a thin coating of paint, metal, etc., to.
surprise.OnWN	2012test	0686	4.250	disregard, fail to attend to	fail to attend to.
surprise.OnWN	2012test	0687	4.000	make a short, sharp sound	make a sharp sound.
surprise.OnWN	2012test	0688	4.750	connect or fasten into a chain by linking	connect or arrange into a chain by linking.
surprise.OnWN	2012test	0689	4.500	beat thoroughly in a competition or fight	beat thoroughly and conclusively in a competition or fight.
surprise.OnWN	2012test	0690	5.000	Look through a book or some other written    material (for information).	look through a book or other written material.
surprise.OnWN	2012test	0691	5.000	state of being active	the state of being active.
surprise.OnWN	2012test	0692	5.000	(theology) the act of deliving from sin or saving from evil.	(theology) the act of delivering from sin or saving from evil.
surprise.OnWN	2012test	0693	4.250	declare or make unfit or unsuitable	make unfit or unsuitable.
surprise.OnWN	2012test	0694	4.000	Cook on a hot surface using fat; cook in oil.	cook on a hot surface using fat.
surprise.OnWN	2012test	0695	4.500	Improve by pruning or polishing	improve or perfect by pruning or polishing.
surprise.OnWN	2012test	0696	4.500	An area that is central within some larger region.	an area that is approximately central within some larger region.
surprise.OnWN	2012test	0697	5.000	start suddenly, as if from fright	start suddenly, as from fright.
surprise.OnWN	2012test	0698	3.750	Be larger in number, quantity, power,          status, or importance, without personally having sovereign power.	be larger in number, quantity, power, status or importance.
surprise.OnWN	2012test	0699	5.000	Give oneself entirely to a specific person,    activity, or cause.	give entirely to a specific person, activity, or cause.
surprise.OnWN	2012test	0700	4.500	the finger next to the thumb, forefinger	the finger next to the thumb.
surprise.OnWN	2012test	0701	4.750	put up with something or someone (unpleasant)	put up with something or somebody unpleasant.
surprise.OnWN	2012test	0702	5.000	role or function of the head of a government department	the role of the head of a government department.
surprise.OnWN	2012test	0703	4.250	consider again, usually with a view to changing	consider again; give new consideration to; usually with a view to changing.
surprise.OnWN	2012test	0704	4.250	drive at an excessive or illegal velocity	travel at an excessive or illegal velocity.
surprise.OnWN	2012test	0705	5.000	an air force military unit, smaller than a squadron	an air force unit smaller than a squadron.
surprise.OnWN	2012test	0706	4.500	the act of giving someone a job, hiring someone	the act of giving someone a job.
surprise.OnWN	2012test	0707	3.500	the act of annoying someone or something	the act of troubling or annoying someone.
surprise.OnWN	2012test	0708	4.000	Droop, sink, or settle from or as if from          pressure or loss of tautness; become less intense.	droop, sink, or settle from or as if from pressure or loss of tautness.
surprise.OnWN	2012test	0709	5.000	Cite as an authority; resort to (as in an argument).	cite as an authority; resort to.
surprise.OnWN	2012test	0710	4.500	Allocate or dedicate; set aside or apart          for a specific purpose or use.	set aside or apart for a specific purpose or use.
surprise.OnWN	2012test	0711	5.000	make out of components (in an improvising manner)	make out of components (often in an improvising manner).
surprise.OnWN	2012test	0712	4.250	rehearse, learn by repetition	learn by repetition.
surprise.OnWN	2012test	0713	5.000	Intend something to move toward a certain goal	intend (something) to move towards a certain goal.
surprise.OnWN	2012test	0714	4.600	register formally as a participant	register formally as a participant or member.
surprise.OnWN	2012test	0715	5.000	write as if with print, not in cursive	write as if with print; not cursive.
surprise.OnWN	2012test	0716	4.400	shoot down birds	shoot down, of birds.
surprise.OnWN	2012test	0717	5.000	appoint to clerical posts	appoint to a clerical posts.
surprise.OnWN	2012test	0718	4.750	(Chemistry) Undergo sequestration by          forming a stable compound with an ion.	undergo sequestration by forming a stable compound with an ion.
surprise.OnWN	2012test	0719	5.000	Furnish with an opening to allow air to          circulate or gase to escape.	furnish with an opening to allow air to circulate or gas to escape.
surprise.OnWN	2012test	0720	5.000	Stand with arms or forelegs raised, as of menacing.	stand with arms or forelegs raised, as if menacing.
surprise.OnWN	2012test	0721	5.000	accounting period of 12 months	any accounting period of 12 months.
surprise.OnWN	2012test	0722	4.250	Convert the genetic information in a strand          of DNA into a strand of RNA.	convert the genetic information in (a strand of DNA) into a strand of RNA, especially messenger RNA.
surprise.OnWN	2012test	0723	4.750	give a thrashing to, beat	give a thrashing to; beat hard.
surprise.OnWN	2012test	0724	5.000	Immerse or be immersed in a boiling liquid,  for purposes of cooking or processing.	immerse or be immersed in a boiling liquid, often for cooking purposes.
surprise.OnWN	2012test	0725	5.000	Supply with water for crops, as with    channels, ditches, or streams.	supply with water, as with channels or ditches or streams.
surprise.OnWN	2012test	0726	4.250	The period of time during which a leasing contract is in effect.	the period of time during which a contract conveying property to a person is in effect.
surprise.OnWN	2012test	0727	4.250	Protect or strengthen with sandbags.	protect or strengthen with sandbags; stop up.
surprise.OnWN	2012test	0728	5.000	travel; make a tour of a place	make a tour of a certain place.
surprise.OnWN	2012test	0729	4.750	the political head of city government	the head of a city government.
surprise.OnWN	2012test	0730	3.250	pass the tongue over, take up with the tongue	take up with the tongue.
surprise.OnWN	2012test	0731	5.000	A city on the River Thames in Bershire, southern England	a city on the River Thames in Berkshire in southern England.
surprise.OnWN	2012test	0732	4.750	a chart or map showing the dimensions, movements or progress of something	a chart or map showing the movements or progress of an object.
surprise.OnWN	2012test	0733	4.750	Take away a vital or essential part of          something.	take away a vital or essential part of.
surprise.OnWN	2012test	0734	4.250	An imperfection; the quality of being inadequate or falling short.	the quality of being inadequate or falling short of perfection.
surprise.OnWN	2012test	0735	4.750	Pat or squeeze, especially under the chin.	pat or squeeze fondly or playfully, especially under the chin.
surprise.OnWN	2012test	0736	4.750	make up something fictional or untrue	make up something artificial or untrue.
surprise.OnWN	2012test	0737	4.250	the act of swallowing liquid	the act of swallowing.
surprise.OnWN	2012test	0738	4.500	have unlawful sex with a prostitute	have unlawful sex with a whore.
surprise.OnWN	2012test	0739	4.000	Reverse the winding or twisting of;  separate the tangles of.	reverse the winding or twisting of.
surprise.OnWN	2012test	0740	4.500	Reimburse or compensate (someone), as for a          loss or sacrifice.	reimburse or compensate (someone), as for a loss.
surprise.OnWN	2012test	0741	3.250	sharpen a razor with a strap	sharpen with a strap.
surprise.OnWN	2012test	0742	4.500	the longer telegraphic signal of Morse Code	the longer of the two telegraphic signals used in Morse code.
surprise.OnWN	2012test	0743	4.250	The part of the body between the neck and upper arm, or any of its subparts.	the part of the body between the neck and the upper arm.
surprise.OnWN	2012test	0744	4.500	Rain, hail, or snow hard and be very windy,    often with thunder and lightning; blow hard.	rain, hail, or snow hard and be very windy, often with thunder or lightning.
surprise.OnWN	2012test	0745	4.250	fill with high spirits	fill with high spirits; fill with optimism.
surprise.OnWN	2012test	0746	3.500	The release of pressure built up during a stop consonant.	the terminal forced release of pressure built up during the occlusive phase of a stop consonant.
surprise.OnWN	2012test	0747	4.500	(cause to) fall in drops	let or cause to fall in drops.
surprise.OnWN	2012test	0748	5.000	The status of being champion.	the status of being a champion.
surprise.OnWN	2012test	0749	3.750	Draw advantages from; take advantage.	draw advantages from.
