surprise.OnWN	2012test	0419	4.000	Fix (something old) with a new part; improve.	piece (something old) with a new part.
surprise.OnWN	2012test	0420	4.250	the act of  damaging something, causing breakage	the act of breaking something.
surprise.OnWN	2012test	0421	3.750	the ground level of a multi-storied building	the floor of a building that is at or nearest to the level of the ground around the building.
surprise.OnWN	2012test	0422	2.250	A quantity of something	a quantity of money.
surprise.OnWN	2012test	0423	3.000	a large room	the large room of a manor or castle.
surprise.OnWN	2012test	0424	4.500	leave out, omit, prevent from entering	prevent from entering; keep out.
surprise.OnWN	2012test	0425	4.000	Sniff at inquiringly.	sniff or smell inquiringly.
surprise.OnWN	2012test	0426	4.750	provide lodging for	provide housing for.
surprise.OnWN	2012test	0427	4.750	Change the purpose or functioning of a system.	change the inherent purpose or function of something.
surprise.OnWN	2012test	0428	4.667	provide with tools or items for a specific purpose	provide with (something) usually for a specific purpose.
surprise.OnWN	2012test	0429	4.000	gain points in a game; add up (numbers)	gain points in a game.
surprise.OnWN	2012test	0430	4.333	travel in front of, be first, precede	travel in front of; go in advance of others.
surprise.OnWN	2012test	0431	4.667	Remove by rubbing	remove by or as if by rubbing or erasing.
surprise.OnWN	2012test	0432	4.667	the hard upper part of the human nose	the hard ridge that forms the upper part of the nose.
surprise.OnWN	2012test	0433	4.333	make shine	make (a surface) shine.
surprise.OnWN	2012test	0434	4.250	recover, return to former state	return to a former condition.
surprise.OnWN	2012test	0435	4.000	remove the pod, husk or shell	remove the husks from.
surprise.OnWN	2012test	0436	4.250	speed up the process of	speed up the progress of; facilitate.
surprise.OnWN	2012test	0437	4.750	(cause to) swing and miss the third pitch, striking out	strike out by swinging and missing the pitch charged as the third.
surprise.OnWN	2012test	0438	3.750	Literally and quantifiably raise in social rank or status.	raise in rank, character, or status.
surprise.OnWN	2012test	0439	3.250	alter by chemical means, to make images.	make visible by means of chemical solutions.
surprise.OnWN	2012test	0440	3.500	highly infectious viral disease	an acute febrile highly contagious viral disease.
surprise.OnWN	2012test	0441	4.250	make a certain size or sort according to size	make to a size; bring to a suitable size.
surprise.OnWN	2012test	0442	4.000	Remove tree stumps from an area.	remove tree stumps from.
surprise.OnWN	2012test	0443	3.250	pass the tongue over, take up with the tongue	pass the tongue over.
surprise.OnWN	2012test	0444	5.000	a computer-generated visual image	an image that is generated by a computer.
surprise.OnWN	2012test	0445	4.000	do better in a competition; win	come out better in a competition, race, or conflict.
surprise.OnWN	2012test	0446	3.500	aerodynamic force that opposed gravity	the component of the aerodynamic forces acting on an airfoil that opposes gravity.
surprise.OnWN	2012test	0447	3.000	Start abruptly, ignite	start abruptly.
surprise.OnWN	2012test	0448	4.000	a local announcement made within a public broadcast	(broadcasting) a local announcement inserted into a network program.
surprise.OnWN	2012test	0449	4.000	making real or concrete	something that is made real or concrete.
surprise.OnWN	2012test	0450	4.000	Sound sharply or shrilly, as if stabbing.	sound sharply or shrilly.
surprise.OnWN	2012test	0451	4.000	the act of officially gaining entrance to somewhere	the act of admitting someone to enter.
surprise.OnWN	2012test	0452	4.000	spend time in prison	spend time in prison or in a labor camp.
surprise.OnWN	2012test	0453	4.750	hold, contain within	contain or hold; have within.
surprise.OnWN	2012test	0454	4.750	act of verbally informing	the act of informing by verbal report.
surprise.OnWN	2012test	0455	4.000	forcefully request	request urgently and forcefully.
surprise.OnWN	2012test	0456	4.500	the quality of dissimilarity	the quality of being unlike or dissimilar.
surprise.OnWN	2012test	0457	4.000	throw quickly, flick	throw quickly.
surprise.OnWN	2012test	0458	3.000	move to and fro around a particular point or points, remain near	move to and fro.
surprise.OnWN	2012test	0459	3.750	Put up with something or someone          unpleasant; show deference towards someone or some authority.	put up with something or somebody unpleasant.
surprise.OnWN	2012test	0460	3.750	the breakup or termination of a social relationship	the termination or disintegration of a relationship (between persons or nations).
surprise.OnWN	2012test	0461	5.000	destruction of a ship	destroy a ship.
surprise.OnWN	2012test	0462	3.500	The human act of making something new.	the act of starting something for the first time; introducing something new.
surprise.OnWN	2012test	0463	4.500	ride (a bicycle or motorcycle)	ride a motorcycle.
surprise.OnWN	2012test	0464	5.000	The principal activity that one does to earn money.	the principal activity in your life that you do to earn money.
surprise.OnWN	2012test	0465	4.750	maintain or preserve a particular condition, state, or activity	continue a certain state, condition, or activity.
surprise.OnWN	2012test	0466	3.750	a spoken or written reply to a question	a statement (either spoken or written) that is made to reply to a question or request or criticism or accusation.
surprise.OnWN	2012test	0467	5.000	committee with supervisory powers	a committee having supervisory powers.
surprise.OnWN	2012test	0468	4.250	a section of a composition, textual or musical	a short section of a musical composition.
surprise.OnWN	2012test	0469	4.750	a gear for changing the motion of a machine to the opposite direction	the gears by which the motion of a machine can be reversed.
surprise.OnWN	2012test	0470	4.500	take a digestion-aiding walk after a meal	take a walk for one's health or to aid digestion, as after a meal.
surprise.OnWN	2012test	0471	3.750	forked form or shape	a part of a forked or branching shape.
surprise.OnWN	2012test	0472	4.750	insert or close with a plug	fill or close tightly with or as if with a plug.
surprise.OnWN	2012test	0473	4.000	incite some act of insubordination	incite, move, or persuade to some act of lawlessness or insubordination.
surprise.OnWN	2012test	0474	3.500	formally announce the termination of an agreement	announce the termination of, as of treaties.
surprise.OnWN	2012test	0475	4.000	beat or pound rapidly	cause to throb or beat rapidly.
surprise.OnWN	2012test	0476	4.000	Make a line or marks on a surface; copy by          following the lines of	make a mark or lines on a surface.
surprise.OnWN	2012test	0477	3.750	recite as a chant, intone	recite with musical intonation; recite as a chant or a psalm.
surprise.OnWN	2012test	0478	4.000	the ability of computers to exchange digital information between them and make use of it	(computer science) the ability to exchange and use information (usually in a large heterogeneous network made up of several local area networks).
surprise.OnWN	2012test	0479	4.500	act of applying force	the act of applying force suddenly.
surprise.OnWN	2012test	0480	5.000	the process of becoming less or smaller	a process of becoming smaller or shorter.
surprise.OnWN	2012test	0481	4.250	Be in command of; exercise authority or  control over.	exercise authoritative control or power over.
surprise.OnWN	2012test	0482	4.250	be a factor or play a role in something	be or play a part of or in.
surprise.OnWN	2012test	0483	4.500	an expanse of land	an extended area of land.
surprise.OnWN	2012test	0484	3.500	move an implement through with a circular motion, mix	move an implement through.
surprise.OnWN	2012test	0485	3.750	deprive of courage, hope, or optimism	deprive of courage or hope; take away hope from; cause to feel discouraged.
surprise.OnWN	2012test	0486	2.750	the armed forces	a force that is a branch of the armed forces.
surprise.OnWN	2012test	0487	2.750	Furnish with metal spurs.	furnish with spars.
surprise.OnWN	2012test	0488	3.250	Remove water from a substance.	remove water from.
surprise.OnWN	2012test	0489	3.250	Provide with rails, as by laying.	provide with rails.
surprise.OnWN	2012test	0490	4.500	make or be a summary	be a summary of.
surprise.OnWN	2012test	0491	3.750	be affected with smut or mildew	affect with smut or mildew, as of a crop such as corn.
surprise.OnWN	2012test	0492	3.000	Talk or behave amorously; have sex with.	talk or behave amorously, without serious intentions.
surprise.OnWN	2012test	0493	3.500	Excuse some minor social infraction; accept    an excuse for something.	accept an excuse for.
surprise.OnWN	2012test	0494	4.750	indicate, be signs or symptoms of	be a signal for or a symptom of.
surprise.OnWN	2012test	0495	3.500	a verbal or written request for access to something.	a verbal or written request for assistance or employment or admission to a school.
surprise.OnWN	2012test	0496	4.750	have a logical result	have as a logical consequence.
surprise.OnWN	2012test	0497	4.750	Travel on foot.	cross on foot.
surprise.OnWN	2012test	0498	4.500	the act of suction	the act of sucking.
surprise.OnWN	2012test	0499	4.250	A band of leather or rope made to identify animals.	a band of leather or rope that is placed around an animal's neck as a harness or to identify it.
surprise.OnWN	2012test	0500	4.750	Put a harness on.	put a harness.
surprise.OnWN	2012test	0501	4.750	Provide or equip specifically with furniture.	provide or equip with furniture.
surprise.OnWN	2012test	0502	4.750	To move (the head or body) quickly    downwards or away (from something).	to move (the head or body) quickly downwards or away.
surprise.OnWN	2012test	0503	5.000	reason or establish by deduction	reason by deduction; establish by deduction.
surprise.OnWN	2012test	0504	3.750	Make pregnant; fertilize and cause to grow.	fertilize and cause to grow.
surprise.OnWN	2012test	0505	5.000	find the solution to or understand the          meaning of	find the solution to (a problem or question) or understand the meaning of.
surprise.OnWN	2012test	0506	4.750	Move about in a confused or purposeless manner.	move about in a confused manner.
surprise.OnWN	2012test	0507	4.250	put up with something unpleasant	put up with something or somebody unpleasant.
surprise.OnWN	2012test	0508	5.000	A means or agency by which something is communicated.	a means or agency by which something is expressed or communicated.
surprise.OnWN	2012test	0509	5.000	take apart into constituent pieces	take apart into its constituent pieces.
surprise.OnWN	2012test	0510	5.000	A short theatrical program that is part of a longer program.	a short theatrical performance that is part of a longer program.
surprise.OnWN	2012test	0511	4.000	decree, issue an order	issue an order.
surprise.OnWN	2012test	0512	5.000	the termination, ending of a meeting	the termination of a meeting.
surprise.OnWN	2012test	0513	5.000	An indicator that orients one generally.	an indicator that orients you generally.
surprise.OnWN	2012test	0514	4.000	Increase the acoustic volume of.	increase the volume of.
surprise.OnWN	2012test	0515	5.000	open to members of all races and ethnic groups	open (a place) to members of all races and ethnic groups.
surprise.OnWN	2012test	0516	5.000	reduce to small pieces by pounding or abrading	reduce to small pieces or particles by pounding or abrading.
surprise.OnWN	2012test	0517	4.000	hit a fly (baseball)	hit a fly.
surprise.OnWN	2012test	0518	3.750	FISHING-exhaust by allowing to pull on the line	exhaust by allowing to pull on the line.
surprise.OnWN	2012test	0519	3.750	be or come into conflict	be incompatible; be or come into conflict.
surprise.OnWN	2012test	0520	3.250	Produce a phonemic click.	produce a click.
surprise.OnWN	2012test	0521	5.000	angle with a hook and line and draw through          water	angle with a hook and line drawn through the water.
surprise.OnWN	2012test	0522	5.000	the front face of a building	the face or front of a building.
surprise.OnWN	2012test	0523	5.000	make something more diverse or varied	make something more diverse and varied.
surprise.OnWN	2012test	0524	4.000	issue bonds on something	issue bonds on.
surprise.OnWN	2012test	0525	5.000	women's sleeveless undergarment	a woman's sleeveless undergarment.
surprise.OnWN	2012test	0526	3.500	Move oneself very fast.	move very fast.
surprise.OnWN	2012test	0527	4.000	Oppose or approach, as in hostility or competition	oppose, as in hostility or a competition.
surprise.OnWN	2012test	0528	3.750	make more complex or intricate	make more complex, intricate, or richer.
surprise.OnWN	2012test	0529	4.250	cause to be/show to be invalid	show to be invalid.
surprise.OnWN	2012test	0530	4.500	create a new entity by putting components or members together	create by putting components or members together.
surprise.OnWN	2012test	0531	4.750	the activity of providing supplies	the activity of supplying or providing something.
surprise.OnWN	2012test	0532	5.000	make or become brighter or lighter	make lighter or brighter.
surprise.OnWN	2012test	0533	5.000	actors in a play	the actors in a play.
surprise.OnWN	2012test	0534	5.000	take someone's soul into heaven	take up someone's soul into heaven.
surprise.OnWN	2012test	0535	5.000	Discipline in personal or social activities.	discipline in personal and social activities.
surprise.OnWN	2012test	0536	4.750	a person eating a meal, often in a restaurant	a person eating a meal (especially in a restaurant).
surprise.OnWN	2012test	0537	4.250	A sudden (emotional) outburst.	a sudden outburst.
surprise.OnWN	2012test	0538	4.000	make or become harder	make hard or harder.
surprise.OnWN	2012test	0539	5.000	the introductory portion of a story	the introductory section of a story.
surprise.OnWN	2012test	0540	3.750	work material with a tool	work with a tool.
surprise.OnWN	2012test	0541	4.500	make or become less strict or severe	make less severe or strict.
surprise.OnWN	2012test	0542	4.750	support by placing on or against something solid	support by placing against something solid or rigid.
surprise.OnWN	2012test	0543	5.000	Part, cease, or break association with (something).	part; cease or break association with.
surprise.OnWN	2012test	0544	5.000	have the financial means to obtain, buy, or do something	have the financial means to do something or buy something.
surprise.OnWN	2012test	0545	4.250	A list of candidates nominated by a political party to run for election.	a list of candidates nominated by a political party to run for election to public offices.
surprise.OnWN	2012test	0546	5.000	say, state, or perform again	to say, state, or perform again.
surprise.OnWN	2012test	0547	5.000	allow the passage of air	allow the passage of air through.
surprise.OnWN	2012test	0548	5.000	unite; merge with something already in existence	unite or merge with something already in existence.
surprise.OnWN	2012test	0549	5.000	use resources or materials	use up (resources or materials).
surprise.OnWN	2012test	0550	5.000	make or become harder	become hard or harder.
surprise.OnWN	2012test	0551	5.000	(Cause to) be firmly attached or closed.	cause to be firmly attached.
surprise.OnWN	2012test	0552	5.000	make or become wider or more extensive	become broader or wider or more extensive.
surprise.OnWN	2012test	0553	4.750	Unrestricted freedom to use something.	unrestricted freedom to use.
surprise.OnWN	2012test	0554	4.750	laying claim, the act of taking possession of, or power over, something.	the act of taking possession of or power over something.
surprise.OnWN	2012test	0555	4.750	give structure to	give a structure to.
surprise.OnWN	2012test	0556	5.000	mark with scars	mark with a scar.
surprise.OnWN	2012test	0557	5.000	(Baseball) Tag the base runner to get him out.	tag the base runner to get him out.
surprise.OnWN	2012test	0558	4.400	Be reflected as heat, light, or shock waves;.	be reflected as heat, sound, or light or shock waves.
surprise.OnWN	2012test	0559	4.800	a competitor most likely to win	a competitor thought likely to win.
surprise.OnWN	2012test	0560	4.600	make or become longer	become long or longer.
surprise.OnWN	2012test	0561	4.600	be on base at the end of an inning	to be on base at the end of an inning, of a player.
surprise.OnWN	2012test	0562	3.500	Either of the two categories (male or female) into which most organisms are divided, or key properties that distinguish the categories.	either of the two categories (male or female) into which most organisms are divided.
surprise.OnWN	2012test	0563	3.500	(science) The atomic weight of an element that has the same combining capacity as a given weight of another element.	the atomic weight of an element that has the same combining capacity as a given weight of another element; the standard is 8 for oxygen.
surprise.OnWN	2012test	0564	4.750	provide with a toggle	provide with a toggle or toggles.
surprise.OnWN	2012test	0565	4.250	(cause to) move back and forth or side to side	cause to move back and forth.
surprise.OnWN	2012test	0566	3.750	measure the depth of a body of water	measure the depth of (a body of water) with a sounding line.
surprise.OnWN	2012test	0567	5.000	make a loud noise, as an animal	make a loud noise, as of animal.
surprise.OnWN	2012test	0568	5.000	The act of coming to rest after a voyage.	the act of coming to land after a voyage.
surprise.OnWN	2012test	0569	5.000	join or bring together (two) objects, ideas, or people	bring two objects, ideas, or people together.
surprise.OnWN	2012test	0570	4.500	Make reference to something.	make reference to.
surprise.OnWN	2012test	0571	4.250	Behave violently, as if in a state of great    anger; break or tear violently.	behave violently, as if in state of a great anger.
surprise.OnWN	2012test	0572	4.750	Form a spiral or move in a spiral course.	move in a spiral or zigzag course.
surprise.OnWN	2012test	0573	4.250	a feeling of aversion, distaste, antipathy	a feeling of aversion or antipathy.
surprise.OnWN	2012test	0574	4.000	Release (gas or energy) as a result of a chemical reaction or physical decomposition (perhaps in a metaphorical sense)	release (gas or energy) as a result of a chemical reaction or physical decomposition.
surprise.OnWN	2012test	0575	4.000	overcome with amazement; flabbergast	overcome with amazement.
surprise.OnWN	2012test	0576	3.750	behave in a condescending manner	behave in a patronizing and condescending manner.
surprise.OnWN	2012test	0577	4.000	take into one's family or group	take into one's family.
surprise.OnWN	2012test	0578	5.000	(Contract bridge) the highest bid becomes the contract setting in the number of tricks that the bidder must make.	(contract bridge) the highest bid becomes the contract setting the number of tricks that the bidder must make.
surprise.OnWN	2012test	0579	5.000	go on a campaign or off to war	go on a campaign; go off to war.
surprise.OnWN	2012test	0580	4.250	react, or respond to a call, command, or stimulus	react to a stimulus or command.
surprise.OnWN	2012test	0581	5.000	(Literally) sound with resonance.	sound with resonance.
surprise.OnWN	2012test	0582	4.750	an injury to the skin caused by radiation, heat or chemicals	an injury caused by exposure to heat or chemicals or radiation.
surprise.OnWN	2012test	0583	4.250	make a causal or logical connection; group together	make a logical or causal connection.
surprise.OnWN	2012test	0584	5.000	Apply conditioner to make smooth and shiny.	apply conditioner to in order to make smooth and shiny.
surprise.OnWN	2012test	0585	5.000	exercise or have power of memory	exercise, or have the power of, memory.
surprise.OnWN	2012test	0586	4.750	A feeling or state of extreme anger.	a state of extreme anger.
surprise.OnWN	2012test	0587	5.000	Wrinkled, crumpled, or creased.	become wrinkled or crumpled or creased.
surprise.OnWN	2012test	0588	5.000	Admit to testing/proof	admit to testing or proof.
surprise.OnWN	2012test	0589	5.000	an accounting period of 12 months	any accounting period of 12 months.
surprise.OnWN	2012test	0590	4.333	praise the qualities in order to sell or promote	make a plug for; praise the qualities or in order to sell or promote.
surprise.OnWN	2012test	0591	3.750	relative darkness of a color	relative darkness or lightness of a color.
surprise.OnWN	2012test	0592	4.250	Strike heavily, especially with a fist or implement.	strike heavily, especially with the fist or a bat.
surprise.OnWN	2012test	0593	4.750	Make receptive or willing toward an action or belief.	make receptive or willing towards an action or attitude or belief.
surprise.OnWN	2012test	0594	5.000	open again, open anew	open again or anew.
surprise.OnWN	2012test	0595	4.000	A conceptual formulation; a way of conceiving something.	a way of conceiving something.
surprise.OnWN	2012test	0596	5.000	heat metal prior to working it	heat a metal prior to working it.
surprise.OnWN	2012test	0597	4.500	feel the strong need to eat	feel the need to eat.
surprise.OnWN	2012test	0598	3.667	be in direct physical contact with	be in direct physical contact with; make contact.
surprise.OnWN	2012test	0599	3.667	Give suck to; receive suck.	give suck to.
surprise.OnWN	2012test	0600	4.333	covering for a bed	decorative cover for a bed.
surprise.OnWN	2012test	0601	5.000	grip, penetrate or tear off with or as if with the teeth or jaws	to grip, cut off, or tear with or as if with the teeth or jaws.
surprise.OnWN	2012test	0602	4.500	play a stringed instrument with a bow	play on a string instrument with a bow.
surprise.OnWN	2012test	0603	4.000	Doubt or an impression that something might    not be the case.	an impression that something might be the case.
surprise.OnWN	2012test	0604	4.750	A successful throw or try for a point after a touchdown.	a successful free throw or try for point after a touchdown.
surprise.OnWN	2012test	0605	4.500	Express audibly; utter sounds (not          necessarily words); indicate.	express audibly; utter sounds (not necessarily words).
surprise.OnWN	2012test	0606	5.000	hold back in uncertainty or unwillingness	pause or hold back in uncertainty or unwillingness.
surprise.OnWN	2012test	0607	5.000	a serving of a beverage	a single serving of a beverage.
surprise.OnWN	2012test	0608	4.500	Give an incentive or reason for action.	give an incentive for action.
surprise.OnWN	2012test	0609	5.000	the day before today	the day immediately before today.
surprise.OnWN	2012test	0610	4.333	take or capture by force or authority	take or capture by force.
surprise.OnWN	2012test	0611	5.000	(Medicine) Apply a plaster cast to.	apply a plaster cast to.
surprise.OnWN	2012test	0612	5.000	interfere with someone else's activity	interfere in someone else's activity.
surprise.OnWN	2012test	0613	5.000	Assign a new time for an event	assign a new time and place for an event.
surprise.OnWN	2012test	0614	4.750	Value measured by what must be given or done to obtain something.	value measured by what must be given or done or undergone to obtain something.
surprise.OnWN	2012test	0615	4.500	touch or hold with the hands	touch, lift, or hold with the hands.
surprise.OnWN	2012test	0616	5.000	scrape or rub to relieve itching	scrape or rub as if to relieve itching.
surprise.OnWN	2012test	0617	4.750	give a detailed account of	narrate or give a detailed account of.
surprise.OnWN	2012test	0618	5.000	Any activity that acquires a person's attention.	any activity that occupies a person's attention.
surprise.OnWN	2012test	0619	5.000	cause to become awake or alert	cause to become awake or conscious.
surprise.OnWN	2012test	0620	4.500	provide a feast or banquet	provide a feast or banquet for.
surprise.OnWN	2012test	0621	5.000	The act of hindering someone's plans or efforts.	an act of hindering someone's plans or efforts.
surprise.OnWN	2012test	0622	4.250	Fool or hoax (someone).	fool or hoax.
surprise.OnWN	2012test	0623	4.750	raising the stakes or bet of a game by a factor of 2	raising the stakes in a card game by a factor of 2.
surprise.OnWN	2012test	0624	4.500	The (period of) control of a country by military forces of a foreign power.	the control of a country by military forces of a foreign power.
surprise.OnWN	2012test	0625	5.000	(computer science) the occurence of an incorrect result produced by a computer.	(computer science) the occurrence of an incorrect result produced by a computer.
surprise.OnWN	2012test	0626	4.000	give pleasure, satifaction, or happiness; be pleasing to	give pleasure to or be pleasing to.
surprise.OnWN	2012test	0627	5.000	the soft padding under a saddle	a soft pad placed under a saddle.
surprise.OnWN	2012test	0628	5.000	elecate or idealize in allusion to Christ's          transfiguration	elevate or idealize, in allusion to Christ's transfiguration.
surprise.OnWN	2012test	0629	4.750	inability of the heart to pump blood to sustain life functions	inability of the heart to pump enough blood to sustain normal bodily functions.
surprise.OnWN	2012test	0630	4.000	cause to vibrate in a different pattern	cause to vibrate in a definite pattern.
surprise.OnWN	2012test	0631	4.500	warn or call to a sense of preparedness	warn or arouse to a sense of danger or call to a state of preparedness.
surprise.OnWN	2012test	0632	4.500	Adapt oneself to new or different conditions.	adapt or conform oneself to new or different conditions.
surprise.OnWN	2012test	0633	4.500	move faster, or cause to move faster	cause to move faster.
surprise.OnWN	2012test	0634	5.000	Supply food ready to eat, as for parties          and banquets.	supply food ready to eat; for parties and banquets.
surprise.OnWN	2012test	0635	4.000	express protest or dissent, raise an objection	express or raise an objection or protest or criticism or express dissent.
surprise.OnWN	2012test	0636	4.250	clear mucus from one's throat	clear mucus or food from one's throat.
surprise.OnWN	2012test	0637	5.000	pass into a state or condition	pass into a specified state or condition.
surprise.OnWN	2012test	0638	3.750	add embellishments (to medieval manuscripts)	add embellishments and paintings to (medieval manuscripts).
