surprise.OnWN	2012test	0198	4.500	train, tutor or polish social behavior, taste, judgement	teach or refine to be discriminative in taste or judgment.
surprise.OnWN	2012test	0199	3.250	a mental activity of construing or interpreting	an interpretation of a text or action.
surprise.OnWN	2012test	0200	4.250	emphasize; draw attention to; underline	draw a line or lines underneath to call attention to.
surprise.OnWN	2012test	0201	2.000	possibility for the future	a prediction of the course of a disease.
surprise.OnWN	2012test	0202	3.250	require or need something that is missing	have need of.
surprise.OnWN	2012test	0203	2.750	an indication or manifestation of something, often physical	an indication of damage.
surprise.OnWN	2012test	0204	3.750	a sudden, brief burst of light	a momentary brightness.
surprise.OnWN	2012test	0205	2.250	come or bring back to life, health, existence or use	cause to regain consciousness.
surprise.OnWN	2012test	0206	3.250	A mental state of sadness.	a mental state characterized by a pessimistic sense of inadequacy and a despondent lack of activity.
surprise.OnWN	2012test	0207	3.750	position or location change	the act of changing the location of something.
surprise.OnWN	2012test	0208	3.750	(cause to) move through a space, circuit or system, usu. returning to the starting point	move in circles.
surprise.OnWN	2012test	0209	3.750	bring in to consonance	bring (several things) into consonance or relate harmoniously.
surprise.OnWN	2012test	0210	1.500	submit, send to	cause to move; cause to be in a certain position or condition.
surprise.OnWN	2012test	0211	3.750	state of being unified	the state of being joined or united or linked.
surprise.OnWN	2012test	0212	3.000	(Cause to) become different or aquire a          different character, possibly during development.	become distinct and acquire a different character.
surprise.OnWN	2012test	0213	3.500	an objective or goal	the goal intended to be attained (and which is believed to be attainable).
surprise.OnWN	2012test	0214	3.500	seize and take captive; take or gain possession of something	take possession of by force, as after an invasion.
surprise.OnWN	2012test	0215	3.250	give, dedicate, pledge	give entirely to a specific person, activity, or cause.
surprise.OnWN	2012test	0216	4.000	decide a specific time for an event	make a schedule; plan the time and place for events.
surprise.OnWN	2012test	0217	4.750	value a thing or course of action more highly than another	like better; value more highly.
surprise.OnWN	2012test	0218	3.750	give something for a cause	give to a charity or good cause.
surprise.OnWN	2012test	0219	3.750	furnish with a guideline	furnish with rubrics or regulate by rubrics.
surprise.OnWN	2012test	0220	2.500	a social entreaty, as courtship or pleading	a petition or appeal made to a person of superior status or rank.
surprise.OnWN	2012test	0221	2.250	fail in strength or health and cease to funtion	break down, literally or metaphorically.
surprise.OnWN	2012test	0222	3.667	reply verbally or in written form to a question, comment, letter, or speech	react verbally.
surprise.OnWN	2012test	0223	3.750	a slight cut in a physical surface	a slight surface cut (especially a notch that is made to keep a tally).
surprise.OnWN	2012test	0224	3.250	cause something to be the case	cause to move; cause to be in a certain position or condition.
surprise.OnWN	2012test	0225	4.000	a state of confinement in a small space	the act of forcing yourself (or being forced) into or through a restricted space.
surprise.OnWN	2012test	0226	4.000	state or explain the meaning	give a definition for the meaning of a word.
surprise.OnWN	2012test	0227	1.250	cause animals to move	pursue for food or sport (as of wild animals).
surprise.OnWN	2012test	0228	4.500	be against, resist	act against or in opposition to.
surprise.OnWN	2012test	0229	4.250	a quantity of money added to a bank account	money deposited in a bank or some similar institution.
surprise.OnWN	2012test	0230	3.250	cause to come into existence; create	bring into being.
surprise.OnWN	2012test	0231	2.500	Performance, routine	a short theatrical performance that is part of a longer program.
surprise.OnWN	2012test	0232	4.250	people assembled together in a rhythmic movement	a party of people assembled for dancing.
surprise.OnWN	2012test	0233	3.000	a computer server	(computer science) a computer that provides client stations with access to files and printers as shared resources to a computer network.
surprise.OnWN	2012test	0234	2.250	forbid, prohibit	forbid the public distribution of ( a movie or a newspaper).
surprise.OnWN	2012test	0235	3.000	computer text files	(computer science) a computer file that contains text (and possibly formatting instructions) using seven-bit ASCII characters.
surprise.OnWN	2012test	0236	2.250	a speech act of acknowledging gratitude for something	an acknowledgment of appreciation.
surprise.OnWN	2012test	0237	3.333	a state of pretending to be someone, something else	an outward semblance that misrepresents the true nature of something.
surprise.OnWN	2012test	0238	2.750	Become widespread as an idea or feeling.	cause to become widely known.
surprise.OnWN	2012test	0239	0.000	connect with; reach a target or goal	perceive with the senses quickly, suddenly, or momentarily.
surprise.OnWN	2012test	0240	4.750	income collected as tax by a government	government income due to taxation.
surprise.OnWN	2012test	0241	2.000	be the deciding factor in a state of affairs or an outcome	shape or influence; give direction to.
surprise.OnWN	2012test	0242	3.000	end	put an end to.
surprise.OnWN	2012test	0243	4.500	a region allocated to hold something	the particular portion of space occupied by something.
surprise.OnWN	2012test	0244	0.750	acknowledge a contribution or cause	have trust in; trust in the truth or veracity of.
surprise.OnWN	2012test	0245	2.000	arrangement	logical or comprehensible arrangement of separate elements.
surprise.OnWN	2012test	0246	3.750	system of arrangement	an arrangement scheme.
surprise.OnWN	2012test	0247	3.750	close within bounds; deprive of freedom	to close within bounds, limit or hold back from movement.
surprise.OnWN	2012test	0248	4.750	to collect, acquire or gather	get or gather together.
surprise.OnWN	2012test	0249	0.500	deliver a formal talk or reprimand at length	censure severely or angrily.
surprise.OnWN	2012test	0250	5.000	a pair of mated people, e.g., married	a pair of people who live together.
surprise.OnWN	2012test	0251	4.750	rot; become unfit for consumption	become unfit for consumption or use.
surprise.OnWN	2012test	0252	3.250	lock with one another	become engaged or intermeshed with one another.
surprise.OnWN	2012test	0253	4.500	take vows, join or allow to join a religious order	take vows, as in religious order.
surprise.OnWN	2012test	0254	4.750	activity of selling	the general activity of selling.
surprise.OnWN	2012test	0255	4.500	give out, allow to have	allow to have.
surprise.OnWN	2012test	0256	4.750	secondary public school, grades 9-12	a public secondary school usually including grades 9 through 12.
surprise.OnWN	2012test	0257	3.000	Benjamin Rush, physician and American Revolutionary leader.	physician and American Revolutionary leader; signer of the Declaration of Independence (1745-1813).
surprise.OnWN	2012test	0258	2.500	luggage compartment of a car	British term for the luggage compartment in a car.
surprise.OnWN	2012test	0259	4.500	have a monopoly of; control fully	have or exploit a monopoly of.
surprise.OnWN	2012test	0260	3.750	reduce to a simpler molecular compound	reduce (petroleum) to a simpler compound by cracking.
surprise.OnWN	2012test	0261	2.500	cause to be interested	attract; cause to be enamored.
surprise.OnWN	2012test	0262	3.500	To remain emotionally or intellectually          attached without necessary physical contact.	to remain emotionally or intellectually attached.
surprise.OnWN	2012test	0263	4.750	The act of transporting goods commerically at rates cheaper than express rates.	transporting goods commercially at rates cheaper than express rates.
surprise.OnWN	2012test	0264	4.500	(An occurance of) the preservation or management of natural resources.	the preservation and careful management of the environment and of natural resources.
surprise.OnWN	2012test	0265	4.000	remove the pod, husk or shell	fall out of the pod or husk.
surprise.OnWN	2012test	0266	4.000	abstain from eating or from certain foods	abstain from eating.
surprise.OnWN	2012test	0267	4.000	feel hot or painful, as if burning	feel hot or painful.
surprise.OnWN	2012test	0268	4.750	(cause to) return after being refused	come back after being refused.
surprise.OnWN	2012test	0269	4.250	a loss of function	loss of ability to function normally.
surprise.OnWN	2012test	0270	3.500	administrator, one who controls resources	someone who controls resources and expenditures.
surprise.OnWN	2012test	0271	3.750	a stovetop, cooking appliance	a kitchen appliance used for cooking food.
surprise.OnWN	2012test	0272	4.500	rinse one's mouth with mouthwash, gargle	rinse one's mouth and throat with mouthwash.
surprise.OnWN	2012test	0273	4.000	a quantity that is an approximate calculation	an approximate calculation of quantity or degree or worth.
surprise.OnWN	2012test	0274	4.000	turn on an axis; spin	turn on or around an axis or a center.
surprise.OnWN	2012test	0275	5.000	marriage offer	an offer of marriage.
surprise.OnWN	2012test	0276	3.500	Try to gain favor by flattering or showing    submission or fear.	show submission or fear.
surprise.OnWN	2012test	0277	4.250	the public submission of a legal record	the entering of a legal document into the public record.
surprise.OnWN	2012test	0278	4.000	Shrivel, wither, or mature imperfectly, as of a flower.	shrivel or wither or mature imperfectly.
surprise.OnWN	2012test	0279	4.250	have faith in, bet on	have faith or confidence in.
surprise.OnWN	2012test	0280	4.250	burst into flames (telic)	start to burn or burst into flames.
surprise.OnWN	2012test	0281	4.500	The cognitive processes and capacity to remember.	the cognitive processes whereby past experience is remembered.
surprise.OnWN	2012test	0282	4.000	mechanism that controls the water level in a section of canal	enclosure consisting of a section of canal that can be closed to control the water level; used to raise or lower vessels that pass through it.
surprise.OnWN	2012test	0283	5.000	an onerous worry or concern	an onerous or difficult concern.
surprise.OnWN	2012test	0284	5.000	someone or something that is the agent of fulfilling desired expectations	someone (or something) on which expectations are centered.
surprise.OnWN	2012test	0285	3.333	a sharp side of an object	a sharp side formed by the intersection of two surfaces of an object.
surprise.OnWN	2012test	0286	2.750	the forceful hit of a ball	hitting a golf ball off of a tee with a driver.
surprise.OnWN	2012test	0287	3.500	Fine powdery material; the remains of something destroyed or broken up.	the remains of something that has been destroyed or broken up.
surprise.OnWN	2012test	0288	2.000	throw with force	utter with force; utter vehemently.
surprise.OnWN	2012test	0289	4.000	Treat a substance with some agent; add an    agent to.	treat with an agent; add (an agent) to.
surprise.OnWN	2012test	0290	3.500	pass through the esophagus	pass through the esophagus as part of eating or drinking.
surprise.OnWN	2012test	0291	4.750	move freely (usually within a bounded space)	cause to move or operate freely within a bounded space.
surprise.OnWN	2012test	0292	3.500	secrete or form water	secrete or form water, as tears or saliva.
surprise.OnWN	2012test	0293	4.000	the state of being in contact	the state of being connected.
surprise.OnWN	2012test	0294	3.500	a variant of a musical theme which employs notes of reduced duration from the original theme	the statement of a theme in notes of lesser duration (usually half the length of the original).
surprise.OnWN	2012test	0295	3.750	time to come	the time yet to come.
surprise.OnWN	2012test	0296	4.750	the legal state of owing money	the state of owing something (especially money).
surprise.OnWN	2012test	0297	4.500	a style and size of typeset	a specific size and style of type within a type family.
surprise.OnWN	2012test	0298	4.000	demand, ask for, or take as one's due	demand as being one's due or property; assert one's right or title to.
surprise.OnWN	2012test	0299	3.500	Cause to be distrusted or rejected; damage the reputation of.	damage the reputation of.
surprise.OnWN	2012test	0300	3.000	Give equal rights to, as of the right to vote.	give equal rights to; of women and minorities.
surprise.OnWN	2012test	0301	3.000	(cause to) lengthen or expand in time or some abstract realm	lengthen in time; cause to be or last longer.
surprise.OnWN	2012test	0302	4.750	a knapsack, bundle on the back	a bundle (especially one carried on the back).
surprise.OnWN	2012test	0303	4.250	a person who delivers information or goods	a person who conveys (carries or transmits).
surprise.OnWN	2012test	0304	4.250	having an intuitive understanding or appreciation of something	an intuitive understanding of something.
surprise.OnWN	2012test	0305	5.000	adherence to moral principles	adhering to moral principles.
surprise.OnWN	2012test	0306	5.000	 have sex with	have sexual intercourse with.
surprise.OnWN	2012test	0307	4.750	partake or provide a banquet	partake in a feast or banquet.
surprise.OnWN	2012test	0308	4.750	idolize/show devotion to	show devotion to (a deity).
surprise.OnWN	2012test	0309	5.000	make a ticking sound	make a clicking or ticking sound.
surprise.OnWN	2012test	0310	3.250	run or flow slowly	run or flow slowly, as in drops or in an unsteady stream.
surprise.OnWN	2012test	0311	4.500	Write a computer programme.	write a computer program.
surprise.OnWN	2012test	0312	5.000	a state of social order in conformance with existing law	a state of order in which events conform to the law.
surprise.OnWN	2012test	0313	4.500	An electronic storage device.	an electronic memory device.
surprise.OnWN	2012test	0314	4.250	a reference line used to align lettering	a light line that is used in lettering to help align the letters.
surprise.OnWN	2012test	0315	3.750	the quality of dedication, fixity of purpose	the trait of sincere and steadfast fixity of purpose.
surprise.OnWN	2012test	0316	4.000	Look furtively at something.	look furtively.
surprise.OnWN	2012test	0317	3.500	cast off, get rid of something	get rid of.
surprise.OnWN	2012test	0318	4.250	recover posession or get back again	get or find back; recover the use of.
surprise.OnWN	2012test	0319	4.750	a coefficient assigned to elements in a frequency distribution in order to indicate the relative importance of each element	(statistics) a coefficient assigned to elements of a frequency distribution in order to represent their relative importance.
surprise.OnWN	2012test	0320	4.000	(cause to) move around	cause to move round and round.
surprise.OnWN	2012test	0321	3.000	become due	become due for repayment.
surprise.OnWN	2012test	0322	3.500	Provide medical care for.	provide veterinary care for.
surprise.OnWN	2012test	0323	3.750	do over, make new	make new.
surprise.OnWN	2012test	0324	4.500	coat, cover, or treat the surface of	put a coat on; cover the surface of; furnish with a surface.
surprise.OnWN	2012test	0325	4.000	BASEBALL: strike out a batter	strike out (a batter), (of a pitcher).
surprise.OnWN	2012test	0326	3.250	Regain or make up for, as of a financial loss.	regain or make up for.
surprise.OnWN	2012test	0327	4.750	duplicate, match	duplicate or match.
surprise.OnWN	2012test	0328	4.250	indistinct vocal articulations	indistinct articulation.
surprise.OnWN	2012test	0329	4.000	the act of shoving something away	the act of applying force in order to move something away.
surprise.OnWN	2012test	0330	5.000	move or drive forcefully as if by a punch.	drive forcibly as if by a punch.
surprise.OnWN	2012test	0331	4.750	an intense surprise, often unpleasant	an unpleasant or disappointing surprise.
surprise.OnWN	2012test	0332	4.250	Make less emotionally hostile; win over          mentally or emotionally.	make less hostile; win over.
surprise.OnWN	2012test	0333	4.250	informal usage for a domestic cat, often young	informal terms referring to a domestic cat.
surprise.OnWN	2012test	0334	4.750	The act of sorting one thing from others.	sorting one thing from others.
surprise.OnWN	2012test	0335	4.000	the act of physically affixing or connecting things	the act of fastening things together.
surprise.OnWN	2012test	0336	4.000	the people who dwell in a camp	a group of people living together in a camp.
surprise.OnWN	2012test	0337	5.000	An unforseen development.	an unforeseen development.
surprise.OnWN	2012test	0338	3.000	bring into general popular/common use	cater to popular taste to make popular and present to the general public; bring into general or common use.
surprise.OnWN	2012test	0339	3.250	make impure; make radioactive	make impure.
surprise.OnWN	2012test	0340	4.750	a long, thin implement, usually made of wood	an implement consisting of a length of wood.
surprise.OnWN	2012test	0341	4.000	Formally reject or disavow a formerly held    belief; retract a statement.	formally reject or disavow a formerly held belief, usually under pressure.
surprise.OnWN	2012test	0342	2.250	(Cause to) to turn to the left side.	turn or go to the port or left side, of a ship.
surprise.OnWN	2012test	0343	3.750	Entail as a necessary accompaniment or result	impose, involve, or imply as a necessary accompaniment or result.
surprise.OnWN	2012test	0344	4.250	Physically attach to something.	fix to; attach.
surprise.OnWN	2012test	0345	4.750	assign to a particular task	assign to a specific task.
surprise.OnWN	2012test	0346	3.750	culminating event	be the culminating event.
surprise.OnWN	2012test	0347	4.750	act of constructing	the act of constructing something.
surprise.OnWN	2012test	0348	4.750	the primary information-processing component of a computer, of a microprocessor chip	(computer science) the part of a computer (a microprocessor chip) that does most of the data processing.
surprise.OnWN	2012test	0349	4.000	consider again, usually with a view to changing	consider again (a bill) that had been voted upon before, with a view to altering it.
surprise.OnWN	2012test	0350	3.500	cancel, reverse, annul	cancel, annul, or reverse an action or its effect.
surprise.OnWN	2012test	0351	4.500	define; determine essential qualities of	determine the essential quality of.
surprise.OnWN	2012test	0352	3.250	The pursuit and killing or capture of animals.	the pursuit and killing or capture of wild animals regarded as a sport.
surprise.OnWN	2012test	0353	3.500	manipulate the registers of a musical instrument	manipulate the registers of an organ.
surprise.OnWN	2012test	0354	3.750	move in an irregular course	move to and fro or from place to place usually in an irregular course.
surprise.OnWN	2012test	0355	4.000	the legal granting or bestowment of rights	the act of granting rights.
surprise.OnWN	2012test	0356	3.750	jolt of electrical current to the body	a reflex response to the passage of electric current through the body.
surprise.OnWN	2012test	0357	4.000	Become pregnant.	become pregnant; undergo conception.
surprise.OnWN	2012test	0358	3.750	the bestowing of a franchise, enfranchisment	the act of certifying or bestowing a franchise on.
surprise.OnWN	2012test	0359	3.750	act of distributing	the act of apportioning or distributing something.
surprise.OnWN	2012test	0360	4.500	The state of being more than satisfied or satiated.	the state of being more than full.
surprise.OnWN	2012test	0361	4.000	conscious subjective emotion or desire	the conscious subjective aspect of feeling or emotion.
surprise.OnWN	2012test	0362	3.750	The act of proposing someone as a candidate for something.	the condition of having been proposed as a suitable candidate for appointment or election.
surprise.OnWN	2012test	0363	4.000	to hunt snipe	hunt or shoot snipe.
surprise.OnWN	2012test	0364	3.500	hunt for hawks	hunt with hawks.
surprise.OnWN	2012test	0365	1.750	a continuous horizontal layer of brick	(construction) a layer of masonry.
surprise.OnWN	2012test	0366	3.750	a brief attempt at some endeavor	a usually brief attempt.
surprise.OnWN	2012test	0367	4.000	propagation of waves back from a surface	the phenomenon of a propagating wave (light or sound) being thrown back from a surface.
surprise.OnWN	2012test	0368	3.500	examine minutely; search diligently	examine minutely.
surprise.OnWN	2012test	0369	3.000	enjoy, be fond of or approve	be fond of.
surprise.OnWN	2012test	0370	5.000	a person under the guardianship or custody of another	a person who is under the protection or in the custody of another.
surprise.OnWN	2012test	0371	4.750	Strike or hit sharply, perhaps as in sport.	strike sharply, as in some sports.
surprise.OnWN	2012test	0372	5.000	Fly in or on a glider plane	fly in or as if in a glider plane.
surprise.OnWN	2012test	0373	4.750	one fourth of a year	a fourth part of a year; three months.
surprise.OnWN	2012test	0374	2.750	make an abstract thing tight or more restrictive	make tight or tighter.
surprise.OnWN	2012test	0375	4.500	provide (a person or group) with power or authority	provide with power and authority.
surprise.OnWN	2012test	0376	3.750	Run at a moderately swift pace, as for exercise.	run at a moderately swift pace.
surprise.OnWN	2012test	0377	4.750	Envelop completely; form a cover over.	form an impenetrable cover over.
surprise.OnWN	2012test	0378	4.250	mold for casting, setting concrete	a mold for setting concrete.
surprise.OnWN	2012test	0379	3.500	cause friction; wear away or erode	wear away or erode.
surprise.OnWN	2012test	0380	4.500	A feeling for something that is desired intensely.	something that is desired intensely.
surprise.OnWN	2012test	0381	4.250	put or store in a bottle	store (liquids or gases) in bottles.
surprise.OnWN	2012test	0382	4.000	Be a sign or indication of; have as a meaning.	be a sign or indication of.
surprise.OnWN	2012test	0383	4.250	the act of choosing, picking one among many	the act of choosing or selecting.
surprise.OnWN	2012test	0384	4.250	act of becoming distant, moving away from	the act of becoming more distant.
surprise.OnWN	2012test	0385	3.750	take in marriage; perform a marriage ceremony	take in marriage.
surprise.OnWN	2012test	0386	4.500	Skip, leap, or move up and down or sideways          as a manner of motion.	skip, leap, or move up and down or sideways.
surprise.OnWN	2012test	0387	3.250	a military fortification, stronghold	a stronghold.
surprise.OnWN	2012test	0388	3.250	the fashionable elite of a given community	the fashionable elite.
surprise.OnWN	2012test	0389	4.500	characteristic call of an animal	the characteristic utterance of an animal.
surprise.OnWN	2012test	0390	4.500	make or become more acute or intense	make more intense, stronger, or more marked.
surprise.OnWN	2012test	0391	4.250	A journey for some purpose.	a journey for some purpose (usually including the return).
surprise.OnWN	2012test	0392	4.000	Fake or falsify; control in a fraudulent manner.	manipulate in a fraudulent manner.
surprise.OnWN	2012test	0393	3.250	fruit cooked down with sugar, jam	fruit preserved by cooking with sugar.
surprise.OnWN	2012test	0394	4.000	the act of leading or guiding others	the activity of leading.
surprise.OnWN	2012test	0395	4.250	coating used as a repellant to moisture	a finishing coat applied to exclude moisture.
surprise.OnWN	2012test	0396	4.250	a person who cleans chimneys	someone who cleans soot from chimneys.
surprise.OnWN	2012test	0397	3.500	Shine intensely; emit a steady, even light    from a source.	emit a steady even light without flames.
surprise.OnWN	2012test	0398	3.500	behave in a certain way; have a specific effect or outcome	behave in a certain way.
surprise.OnWN	2012test	0399	4.500	communicate with a hiss	express or utter with a hiss.
surprise.OnWN	2012test	0400	3.750	a male bee whose function is to fertilize the queen	stingless male bee in a colony of social bees (especially honeybees) whose sole function is to mate with the queen.
surprise.OnWN	2012test	0401	3.750	a sporting match, boxing	a boxing or wrestling match.
surprise.OnWN	2012test	0402	4.500	cause to reproduce (plants or animals)	cause to procreate (animals).
surprise.OnWN	2012test	0403	4.750	The feeling of annoyance at being hindered or thwarted.	a feeling of annoyance at being hindered or criticized.
surprise.OnWN	2012test	0404	4.250	move along on wheels	move along on or as if on wheels or a wheeled vehicle.
surprise.OnWN	2012test	0405	3.750	[provide with a new or different resting place	provide with a new seat.
surprise.OnWN	2012test	0406	4.500	activity of extracting ore or other matter from the ground	the act of extracting ores or coal etc from the earth.
surprise.OnWN	2012test	0407	3.500	to interrupt, enter uninvited	enter uninvited.
surprise.OnWN	2012test	0408	4.000	A person or thing equal to another in value or significane.	a person or thing equal to another in value or measure or force or effect or significance etc.
surprise.OnWN	2012test	0409	3.750	a cause or source of harm	a cause of pain or injury or loss.
surprise.OnWN	2012test	0410	4.500	make (more) comprehensible	make clear and (more) comprehensible.
surprise.OnWN	2012test	0411	4.500	the state of being retained	the act of retaining something.
surprise.OnWN	2012test	0412	4.000	a problem, something wrong	a problem.
surprise.OnWN	2012test	0413	4.750	stretch out or over completely	stretch out completely.
surprise.OnWN	2012test	0414	2.500	continue to live, exist, or prosper	continue to live through hardship or adversity.
surprise.OnWN	2012test	0415	3.750	a caress with the lips	the act of caressing with the lips (or an instance thereof).
surprise.OnWN	2012test	0416	3.500	Provide with rails, as by laying.	lay with rails.
surprise.OnWN	2012test	0417	4.500	the close approach of one object to another	the motion of one object relative to another.
surprise.OnWN	2012test	0418	4.000	make a hole with a pointed tool	make a hole, especially with a pointed power or hand tool.
